,Incident,Location,Reported,Occurred,Comments / Nature of Fire,Disposition,UCPDI#,Reported_datetime,Occurred_range_or_exact,Occurred_lower_range,Occurred_upper_range
0,lost property,5810 s. university (quad),7/1/10 12:42 pm,6/28/10 2:45 pm,Woman reports losing a Canon Power Shot digital camera while in the Quad,closed,W0731,2010-07-01 12:42:00,exact,2010-06-28 14:45:00,2010-06-28 14:45:00
1,criminal damage to vehicle,61st & drexel,7/1/10 2:01 pm,6/29/10 to 7/1/10 3:00 pm to 1:50 pm,Unknown person smashed windshield of a rental truck parked in a vacant lot,open,W0732,2010-07-01 14:01:00,range,2010-06-29 15:00:00,2010-07-01 13:50:00
2,theft from motor vehicle,60th between ingleside & ellis,7/1/10 2:48 pm,6/29/10 to 7/1/10 5:30 pm to 12:30 pm,Unknown person smashed rear passenger's side window of vehicle parked on the street and took a GPS device,open,W0733,2010-07-01 14:48:00,range,2010-06-29 17:30:00,2010-07-01 12:30:00
3,theft,60th and ellis,7/1/10 3:13 pm,6/23/10 to 6/29/10 9:00 am to 5:00 pm,Bicycle taken from bike rack,open,W0734,2010-07-01 15:13:00,range,2010-06-23 09:00:00,2010-06-29 17:00:00
4,chemical spill,924 e. 57th st. (bslc),7/1/10 6:15 pm,7/1/10 6:15 pm,"Bottle slipped from man's hands, broke causing chemical to spill on his clothes, countertop and floor / Safety notified / No injuries",closed,W0735,2010-07-01 18:15:00,exact,2010-07-01 18:15:00,2010-07-01 18:15:00
5,lost property,"out of area - palos heights, il",7/1/10 11:09 pm,7/1/10 10:00 pm,Staff member reports losing wallet containing UC ID while in a restaurant,closed,W0736,2010-07-01 23:09:00,exact,2010-07-01 22:00:00,2010-07-01 22:00:00
6,possession of cannabis,everett at 56th,7/1/10 11:50 pm,7/1/10 11:50 pm,UCPD officers arrested two males for possession of marijuana,arrest,W0737,2010-07-01 23:50:00,exact,2010-07-01 23:50:00,2010-07-01 23:50:00
7,battery,maryland between 53rd & 54th,7/1/10 10:45 pm,7/1/10 10:45 pm,"A man, who appeared to be intoxicated, struck another man for no apparent reason / Arrest",arrest,W0738,2010-07-01 22:45:00,exact,2010-07-01 22:45:00,2010-07-01 22:45:00
8,robbery,55th at kenwood,7/2/10 2:24 pm,7/2/10 1:45 am,"A group of youths knocked a man to the ground and took his cell phone, MP3 player and head phones",open,W0739,2010-07-02 14:24:00,exact,2010-07-02 01:45:00,2010-07-02 01:45:00
9,injured person,55th at woodlawn,7/3/10 12:45 am,7/2/10 10:20 pm,Man riding bicycle struck by a motor vehicle at the intersection / Transported to hospital by CFD EMS,closed,W0741,2010-07-03 00:45:00,exact,2010-07-02 22:20:00,2010-07-02 22:20:00
10,disturbance,university between 56th & 57th,7/3/10 2:05 am,7/3/10 2:05 am,Loud noise and music at a residence / Peace restored,closed,W0740,2010-07-03 02:05:00,exact,2010-07-03 02:05:00,2010-07-03 02:05:00
11,injured person,5815 s. maryland (mitchell hosp.),7/3/10 1:43 pm,7/3/10 1:20 pm,"Woman walked out of main entrance, tripped over rug, fell injuring right knee / Refused medical attention",closed,W0742,2010-07-03 13:43:00,exact,2010-07-03 13:20:00,2010-07-03 13:20:00
12,theft,5530 s. ellis (ratner ac),7/3/10 5:12 pm,7/3/10 4:00 pm to 5:00 pm,"Unknown person took duffel bag, keys, and miscellaneous articles from a locked gym locker / Lock also taken",open,W0743,2010-07-03 17:12:00,range,2010-07-03 16:00:00,2010-07-03 17:00:00
13,disturbance,university between 56th & 57th,7/4/10 12:10 am,7/4/10 12:00 am,Neighbors complained of people setting off fireworks / Peace restored,closed,W0744,2010-07-04 00:10:00,exact,2010-07-04 00:00:00,2010-07-04 00:00:00
14,fire,1118 e. 58th st. (eckhart hall),7/4/10 2:05 am,7/4/10 2:00 am,Small fire in trash can outside of Eckhart Hall / Extinguished / CFD responded,closed,W0745,2010-07-04 02:05:00,exact,2010-07-04 02:00:00,2010-07-04 02:00:00
15,attempt burglary,61st between ingleside & ellis,7/4/10 7:46 am,7/4/10 7:20 am,Unknown male subject gained entry to residence via open window / Suspect fled when confronted by occupant,open,W0746,2010-07-04 07:46:00,exact,2010-07-04 07:20:00,2010-07-04 07:20:00
16,theft from motor vehicle,midway pl. between cottage grove & drexel,7/5/10 12:12 pm,7/5/10 7:00 am to 11:45 am,Unknown person smashed passenger's side vent window of car parked on the street and took a GPS device,open,W0747,2010-07-05 12:12:00,range,2010-07-05 07:00:00,2010-07-05 11:45:00
17,unlawful use of a weapon,58th at university,7/5/10 7:12 pm,7/5/10 7:08 pm,UCPD officers arrested a male for possession of an air pistol and theft of a bicycle,arrest,W0748,2010-07-05 19:12:00,exact,2010-07-05 19:08:00,2010-07-05 19:08:00
20,burglary,ingleside between 51st & 52nd,7/6/10 10:50,7/3/10 to 7/6/10 2:00 pm to 7:00 am,"Unknown person(s) forced entry to vacant building being renovated and took new stoves, refrigerators and microwaves",open,W0753,2010-07-06 10:50:00,range,2010-07-03 14:00:00,2010-07-06 07:00:00
21,theft,5801 s. ellis (quad),7/6/10 13:13,7/6/10 11:15,Unknown person took unattended Echo gas hedge trimmer from the bed of a Facilities ATV,open,W0751,2010-07-06 13:13:00,exact,2010-07-06 11:15:00,2010-07-06 11:15:00
22,theft,5811 s. ellis (cobb hall),7/6/10 13:16,7/6/10 12:35 pm to 12:55 pm,Unknown person took an unattended Mac Book Pro laptop computer from a study pod,open,W0752,2010-07-06 13:16:00,range,2010-07-06 12:35:00,2010-07-06 12:55:00
23,telephone harassment,6054 s. drexel (uc office bldg),7/6/10 16:09,7/6/10 7:40 am to 1:00 pm,Staff member reports a person is constantly calling and harassing her via telephone at work,open,W0754,2010-07-06 16:09:00,range,2010-07-06 07:40:00,2010-07-06 13:00:00
24,pubic indecency,greenwood at 56th,7/6/10 21:11,7/6/10 21:11,Male performing an indecent act on the public way was observed and arrested by UCPD officers / Also charged with failing to register new address as a sex offender,arrest,W0757,2010-07-06 21:11:00,exact,2010-07-06 21:11:00,2010-07-06 21:11:00
25,theft,5640 s. university (bartlett commons),7/6/10 21:36,7/2/10 to 7/6/10 4:00 pm to 6:15 pm,Bicycle chained to bike rack taken,open,W0755,2010-07-06 21:36:00,range,2010-07-02 16:00:00,2010-07-06 18:15:00
26,criminal trespass to property,5514 s. university (pierce hall),7/6/10 21:50,7/6/10 21:50,Man ignored previous warnings arrested by UCPD for trespass,arrest,W0756,2010-07-06 21:50:00,exact,2010-07-06 21:50:00,2010-07-06 21:50:00
27,fire alarm,6035 s. blackstone (chiller plant),7/7/10 5:27 am,7/7/10 5:27 am,Alarm malfunction / CFD responded,closed,W0758,2010-07-07 05:27:00,exact,2010-07-07 05:27:00,2010-07-07 05:27:00
28,criminal damage to vehicle,ingleside at 55th,7/7/10 12:23 pm,7/7/10 8:00 am to 12:00 pm,Unknown person smashed passenger's side rear window of a car parked on the street,open,W0759,2010-07-07 12:23:00,range,2010-07-07 08:00:00,2010-07-07 12:00:00
29,theft,1101 e. 57th st. (zoology),7/7/10 1:22 pm,7/7/10 11:00 am to 12:45 pm,Unknown person entered an unlocked room and removed a MacBook computer from a cable lock,open,W0760,2010-07-07 13:22:00,range,2010-07-07 11:00:00,2010-07-07 12:45:00
30,theft from motor vehicle,hyde park between 55th & 56th,7/7/10 6:17 pm,7/4/10 to 7/7/10 11:00 pm to 6:00 pm,Unknown person smashed window of car parked on the street and took a 35 lb. bag of dog food,open,W0761,2010-07-07 18:17:00,range,2010-07-04 23:00:00,2010-07-07 18:00:00
31,criminal trespass to property,1126 e. 59th st. (social science),7/8/10 2:27 pm,7/8/10 2:27 pm,Man ignored previous warning and was arrested by UCPD for trespass,arrest,W0762,2010-07-08 14:27:00,exact,2010-07-08 14:27:00,2010-07-08 14:27:00
32,miscellaneous,6054 s. drexel (ucpd),7/8/10 5:50 pm,7/8/10 5:50 pm,Domestic situation involving custody of children,closed,W0763,2010-07-08 17:50:00,exact,2010-07-08 17:50:00,2010-07-08 17:50:00
33,fire alarm,940 e. 57th st. (bio-psychological research),7/9/10 8:45 am,7/9/10 8:30 am,Alarm triggered by leaking water heater / No fire,closed,W0764,2010-07-09 08:45:00,exact,2010-07-09 08:30:00,2010-07-09 08:30:00
34,sexual assault,54th between woodlawn & kimbark,7/9/10 1:09 pm,7/9/10 1:05 pm,Male subject armed with a knife demanded and took money from a woman in a building vestibule and attempted to sexually assault her / Arrest by UCPD,arrest,W0765,2010-07-09 13:09:00,exact,2010-07-09 13:05:00,2010-07-09 13:05:00
35,burglary,54th between cottage grove and drexel,7/9/10 4:42 pm,7/9/10 9:30 am to 4:30 pm,Unknown person(s) gained entry to apartment and took 2 laptop computers and a Gameboy / No sign of forced entry,open,W0766,2010-07-09 16:42:00,range,2010-07-09 09:30:00,2010-07-09 16:30:00
36,fire alarm,5630 s. university (max palevsky east),7/9/10 6:13 pm,7/9/10 6:13 pm,Smoke detector malfunction / CFD responded,closed,W0767,2010-07-09 18:13:00,exact,2010-07-09 18:13:00,2010-07-09 18:13:00
37,disturbance,university between 56th & 57th,7/10/10 4:55 am,7/10/10 4:55 am,Complaint of people setting off fireworks / Peace restored,closed,W0768,2010-07-10 04:55:00,exact,2010-07-10 04:55:00,2010-07-10 04:55:00
38,hazardous material incident,920 e. 58th st. (cummings life science ctr.),7/10/10 3:28 pm,7/10/10 1:35 pm,Researcher accidently spilled chemical substance / Safety and CFD notified. CFD Haz. Mat. Team responded / Cleaned area.,closed,W0769,2010-07-10 15:28:00,exact,2010-07-10 13:35:00,2010-07-10 13:35:00
39,fire alarm,940 e. 57th st. (bio-psychological science),7/11/10 12:07 am,7/11/10 12:07 am,Alarm malfunction / CFD responded,closed,W0770,2010-07-11 00:07:00,exact,2010-07-11 00:07:00,2010-07-11 00:07:00
40,activated alarm,5801 s. ellis (admin. building),7/11/10 4:42 am,7/11/10 4:42 am,Apparent alarm malfunction / Premise secure,closed,W0771,2010-07-11 04:42:00,exact,2010-07-11 04:42:00,2010-07-11 04:42:00
41,fire,62nd st. between drexel & ingleside,7/11/10 8:43 am,7/11/10 8:35 am,ComEd transformer in the alley sparked and caught fire / CFD extinguished / ComEd on scene,closed,W0772,2010-07-11 08:43:00,exact,2010-07-11 08:35:00,2010-07-11 08:35:00
42,criminal sexual assault,53rd at ellis,7/11/10 2:21 pm,7/11/10 2:10 pm,A male acquaintance visiting a female forced sexual intercourse against her will,open,W0773,2010-07-11 14:21:00,exact,2010-07-11 14:10:00,2010-07-11 14:10:00
43,burglary,58th between kimbark & kenwood,7/11/10 8:29 pm,7/11/10 8:20 pm,Residents came home and found a male subject had broken into their apartment / Suspect fled before police arrived,open,W0774,2010-07-11 20:29:00,exact,2010-07-11 20:20:00,2010-07-11 20:20:00
44,disturbance,1100 e. 57th st. (regenstein library),7/11/10 9:55 pm,7/11/10 9:50 pm,Male subject created a disturbance when a staff member told him it was too late to check out a book,closed,W0775,2010-07-11 21:55:00,exact,2010-07-11 21:50:00,2010-07-11 21:50:00
45,theft,5721 s. maryland (comer hospital),7/12/10 7:37 am,7/9/10 2:00 pm to 7/12/10 5:30 am,Unknown person took17 files from a file cabinet,open,W0776,2010-07-12 07:37:00,range,2010-07-09 14:00:00,2010-07-12 05:30:00
46,disturbance,university between 56th & 57th,7/13/10 12:35 am,7/13/10 12:35 am,Neighbors complained of loud noisy party outside of a residence / Peace restored,closed,W0777,2010-07-13 00:35:00,exact,2010-07-13 00:35:00,2010-07-13 00:35:00
47,injured person,5514 s. university (pierce hall),7/13/10 2:27 pm,7/13/10 2:20 pm,Man climbing fence cut his wrist / Transported to ER by CFD EMS,closed,W0778,2010-07-13 14:27:00,exact,2010-07-13 14:20:00,2010-07-13 14:20:00
48,criminal damage to property,kimbark at 53rd,7/13/10 4:57 pm,7/13/10 12:00 pm to 3:00 pm,Unknown person scrawled graffiti on the side of a residential building,open,W0779,2010-07-13 16:57:00,range,2010-07-13 12:00:00,2010-07-13 15:00:00
49,warrant arrest,53rd at maryland,7/13/10 6:16 pm,7/13/10 6:16 pm,UCPD officers arrested a man wanted on a warrant,arrest,W0780,2010-07-13 18:16:00,exact,2010-07-13 18:16:00,2010-07-13 18:16:00
50,irregular conditions,1059 e. 59th st. (classics),7/14/10 6:54 am,7/14/10 6:54 am,Alarm malfunction due to a power outage,closed,W0781,2010-07-14 06:54:00,exact,2010-07-14 06:54:00,2010-07-14 06:54:00
51,theft,6030 s. ellis (edelstone center),7/14/10 10:43 am,7/13/10 2:00 pm to 4:00 pm,Unknown person entered unsecured office and took unattended wallet left on a desk,open,W0782,2010-07-14 10:43:00,range,2010-07-13 14:00:00,2010-07-13 16:00:00
52,fire/smoke report,924 e. 57th st. (knapp center),7/14/10 12:33 pm,7/14/10 12:33 pm,Plastic accidently placed in a sterilizer oven caused smoke / CFD responded,closed,W0783,2010-07-14 12:33:00,exact,2010-07-14 12:33:00,2010-07-14 12:33:00
53,theft,5706 s. university (reynolds club),7/14/10 6:23 pm,7/13/10 to 7/14/10 6:30 pm to 10:00 am,Three keys to the facility taken from an unattended key ring left in a mail box,open,W0784,2010-07-14 18:23:00,range,2010-07-13 18:30:00,2010-07-14 10:00:00
54,sick person,5845 s. ellis (gates-blake),7/15/10 8:41 am,7/15/10 8:41 am,Sick person transported to ER by CFD EMS / Treated and released,closed,W0785,2010-07-15 08:41:00,exact,2010-07-15 08:41:00,2010-07-15 08:41:00
55,theft,5550 s. university (crown field house),7/15/10 12:51 pm,7/15/10 9:45 am to 12:45 pm,Bicycle chained to bike rack taken by unknown person,open,W0786,2010-07-15 12:51:00,range,2010-07-15 09:45:00,2010-07-15 12:45:00
56,theft,5815 s. maryland (mitchell hospital),7/15/10 3:02 pm,7/15/10 11:00 am to 12:55 pm,Unknown person took wallet from a purse that was placed on the floor under the table while dining / Unauthorized use of credit card subsequently reported,open,W0787,2010-07-15 15:02:00,range,2010-07-15 11:00:00,2010-07-15 12:55:00
57,possession of cannabis,1212 e. 59th st. (ida noyes),7/15/10 3:37 pm,7/15/10 3:37 pm,UCPD officer questioning suspicious male in Ida Noyes discovered subject possessed marijuana / Arrest,arrest,W0788,2010-07-15 15:37:00,exact,2010-07-15 15:37:00,2010-07-15 15:37:00
58,stuck elevator,5455 s. blackstone (neighborhood res.),7/15/10 8:12 pm,7/15/10 8:10 pm,Woman freed from stuck elevator by CFD,closed,W0789,2010-07-15 20:12:00,exact,2010-07-15 20:10:00,2010-07-15 20:10:00
59,irregular condition,5640 s. university (bartlett commons),7/16/10 12:42 am,7/16/10 12:42 am,During a premise check UCPD officer found exterior door not properly secured / Premises checked and secured,closed,W0790,2010-07-16 00:42:00,exact,2010-07-16 00:42:00,2010-07-16 00:42:00
60,theft,6420 s. university (charter school),7/16/10 9:10 am,6/18/10 3:40 pm,Former staff member refused to return a MacBook laptop computer when he was terminated,open,W0791,2010-07-16 09:10:00,exact,2010-06-18 15:40:00,2010-06-18 15:40:00
61,sick person,6054 s. drexel (ucpd),7/16/10 11:54 am,7/16/10 11:54 am,Staff member complained of chest pains / Transported to Mitchell ER by CFD EMS,closed,W0792,2010-07-16 11:54:00,exact,2010-07-16 11:54:00,2010-07-16 11:54:00
62,theft,cornell between 51st & 52nd,7/16/10 1:49 pm,7/15/10 to 7/16/10 8:30 pm to 12:30 pm,Unknown person took bicycle chained to rear porch of residence,open,W0793,2010-07-16 13:49:00,range,2010-07-15 20:30:00,2010-07-16 12:30:00
63,theft,woodlawn at 54th,7/16/10 3:29 pm,7/15/10 to 7/16/10 7:00 pm to 9:30 am,Bicycle chained to city stop sign taken by unknown person,open,W0794,2010-07-16 15:29:00,range,2010-07-15 19:00:00,2010-07-16 09:30:00
64,robbery,ellis between 51st & 52nd,7/16/10 8:37 pm,7/16/10 8:30 pm,Man walking on the street was attacked by five youths who punched him and took his property / 1 arrest / some property recovered,arrest,W0795,2010-07-16 20:37:00,exact,2010-07-16 20:30:00,2010-07-16 20:30:00
65,disturbance,university between 56th & 57th,7/17/10 3:58 am,7/17/10 3:56 am,Neighbors complained of loud music at a residence / Peace restored,closed,W0796,2010-07-17 03:58:00,exact,2010-07-17 03:56:00,2010-07-17 03:56:00
66,theft,cornell between 50th & 51st,7/17/10 12:54 pm,7/17/10 11:00 am to 11:30 am,Unknown person took purse that was placed behind a chair that complainant occupied,open,W0797,2010-07-17 12:54:00,range,2010-07-17 11:00:00,2010-07-17 11:30:00
67,theft,970 e. 58th st. (bookstore),7/17/10 2:30 pm,7/17/10 1:00 pm,Unknown person took coin purse containing credit card from an unattended handbag left at workstation,open,W0798,2010-07-17 14:30:00,exact,2010-07-17 13:00:00,2010-07-17 13:00:00
68,theft,5815 s. maryland (mitchell hospital),7/17/10 4:23 pm,7/16/10 to 7/17/10 7:00 pm to 3:00 pm,$400 taken from unattended purse left in patient's room,open,W0799,2010-07-17 16:23:00,range,2010-07-16 19:00:00,2010-07-17 15:00:00
69,theft,1118 e. 58th st. (eckhart hall),7/18/10 6:55 am,7/16/10 to 7/17/10 7:30 pm to 9:30 pm,Unknown person took an Apple MacBook laptop computer from a room,open,W0800,2010-07-18 06:55:00,range,2010-07-16 19:30:00,2010-07-17 21:30:00
70,theft,56th between woodlawn and kimbark,7/18/10 11:01 am,7/18/10 12:30 am to 10:30 am,Unknown person smashed driver's side window of car parked on the street and took a Sony digital camera and an i-Pod from the glove box,open,W0801,2010-07-18 11:01:00,range,2010-07-18 00:30:00,2010-07-18 10:30:00
71,criminal trespass to land,5800 s. stony island (doctors hospital),7/18/10 12:42 pm,7/18/10 12:42 pm,UCPD arrested a man for trespassing to the vacant and boarded former Doctors Hospital building,arrest,W0802,2010-07-18 12:42:00,exact,2010-07-18 12:42:00,2010-07-18 12:42:00
72,lost property,5815 s. maryland (mitchell hospital),7/18/10 7:19 pm,7/18/10 2:00 pm to 7:00 pm,Patient's cell phone missing after she transferred rooms,closed,W0803,2010-07-18 19:19:00,range,2010-07-18 14:00:00,2010-07-18 19:00:00
73,burglary,greenwood between 48th & 49th,7/19/10 11:51 am,7/18/10 12:00 pm to 1:00 pm,"Unknown person(s) entered a residence via a rear window taking a lap top computer, marble chess set, and jewelry",open,W0804,2010-07-19 11:51:00,range,2010-07-18 12:00:00,2010-07-18 13:00:00
74,cyberstalking,5841 s. maryland (mitchell hospital),7/19/10 12:30 pm,7/16/10 to 7/18/10 8:50 pm to 10:15 pm,Report of receipt of annoying email messages,open,W0805,2010-07-19 12:30:00,range,2010-07-16 20:50:00,2010-07-18 22:15:00
75,theft,57th between harper & lake park,7/19/10 3:54 pm,7/18/10 to 7/19/10 12:30 am to 9:30 am,A Sony Playstation and an X-Box were taken from an apartment during the course of a party,open,W0806,2010-07-19 15:54:00,range,2010-07-18 00:30:00,2010-07-19 09:30:00
76,recovered motor vehicle,blackstone at 54th pl.,7/19/10 11:11 pm,7/19/10 11:11 pm,"UCPD officer recovered stolen, unattended vehicle parked on the street / Turned over to CPD",closed,W0807,2010-07-19 23:11:00,exact,2010-07-19 23:11:00,2010-07-19 23:11:00
77,theft,1025 e. 58th st. (swift hall),7/20/10 12:07 pm,7/20/10 11:30 am,"Unknown male entered coffee shop, ate two dinners and left without paying",open,W0808,2010-07-20 12:07:00,exact,2010-07-20 11:30:00,2010-07-20 11:30:00
78,irregular condition,1025 e. 58th st. (swift hall),7/20/10 12:17 pm,7/20/10 12:17 pm,Power outage reported / Power restored at 1:40 PM,closed,W0809,2010-07-20 12:17:00,exact,2010-07-20 12:17:00,2010-07-20 12:17:00
79,theft,1101 e. 56th st. (max palevsky central),7/20/10 3:12 pm,7/12/10 to 7/20/10 8:00 am to 3:00 pm,Bicycle chained to metal fence taken by unknown person,open,W0810,2010-07-20 15:12:00,range,2010-07-12 08:00:00,2010-07-20 15:00:00
80,theft,5550 s. university (crown field house),7/20/10 4:20 pm,7/20/10 3:30 pm to 4:20 pm,Unknown person(s) forced open three gym locker doors and took three cell phones,open,W0812,2010-07-20 16:20:00,range,2010-07-20 15:30:00,2010-07-20 16:20:00
81,battery,5706 s. university (reynolds club),7/20/10 5:07 pm,7/20/10 4:45 pm,Unknown male placed his hand on woman's buttocks as they passed in a hallway / Suspect fled,open,W0811,2010-07-20 17:07:00,exact,2010-07-20 16:45:00,2010-07-20 16:45:00
82,assault,1118 e. 58th st. (eckhart hall),7/20/10 5:34 pm,7/20/10 2:20 pm,Woman felt threatened after a verbal exchange with a man dissatisfied with service,open,W0813,2010-07-20 17:34:00,exact,2010-07-20 14:20:00,2010-07-20 14:20:00
83,fire / smoke report,1100 e. 58th st. (quad),7/20/10 8:16 pm,7/20/10 8:15 pm,Small fire in trash container in the Quad extinguished by CFD / No damage,closed,W0814,2010-07-20 20:16:00,exact,2010-07-20 20:15:00,2010-07-20 20:15:00
84,recovered motor vehicle,woodlawn between 55th & 56th,7/21/10 12:04 am,7/21/10 12:04 am,UCPD officer arrested male subject in possession of a stolen motorcycle,arrest,W0816,2010-07-21 00:04:00,exact,2010-07-21 00:04:00,2010-07-21 00:04:00
85,injured person,5815 s. kimbark (belfield hall),7/21/10 3:23 am,7/21/10 3:23 am,Deliveryman fell down stairs injuring his lower back and head / Transported to ER by CFD EMS,closed,W0815,2010-07-21 03:23:00,exact,2010-07-21 03:23:00,2010-07-21 03:23:00
86,criminal damage to property,55th between drexel and ellis,7/21/10 2:57 pm,7/20/10 to 7/21/10 7:00 pm to 3:00 pm,Unknown person shattered rear window of a car parked on the street,open,W0817,2010-07-21 14:57:00,range,2010-07-20 19:00:00,2010-07-21 15:00:00
87,damage to property,6031 s. ellis (south campus residence hall),7/21/10 2:13 pm,7/19/10 to 7/21/10 8:00 pm to 2:00 pm,Window damaged / Cause Undetermined,closed,W0818,2010-07-21 14:13:00,range,2010-07-19 20:00:00,2010-07-21 14:00:00
88,fire alarm,6031 s. ellis (south campus residence hall),7/21/10 6:12 pm,7/21/10 6:12 pm,Alarm malfunction / CFD responded,closed,W0819,2010-07-21 18:12:00,exact,2010-07-21 18:12:00,2010-07-21 18:12:00
89,fire alarm,5700 s. stony island,7/21/10 9:43 pm,7/21/10 9:43 pm,Smoke from over-cooked food triggered alarm / No fire / CFD responded,closed,W0820,2010-07-21 21:43:00,exact,2010-07-21 21:43:00,2010-07-21 21:43:00
90,fire alarm,1010 e. 59th st. (classics),7/22/10 10:31 am,7/22/10 10:31 am,Alarm accidently triggered by contractor servicing system / CFD responded,closed,W0821,2010-07-22 10:31:00,exact,2010-07-22 10:31:00,2010-07-22 10:31:00
91,criminal trespass to land,5811 s. ellis (cobb hall),7/22/10 1:15 pm,7/22/10 1:15 pm,UCPD officers arrested male subject for trespass and possession of burglary tools,arrest,W0822,2010-07-22 13:15:00,exact,2010-07-22 13:15:00,2010-07-22 13:15:00
92,theft from motor vehicle,56th between greenwood & university,7/22/10 3:39 pm,7/22/10 3:30 pm,Unknown person broke window of van parked on the street and took bicycle and GPS device,open,W0824,2010-07-22 15:39:00,exact,2010-07-22 15:30:00,2010-07-22 15:30:00
93,theft,1137 e. 57th st. (hutchinson commons),7/22/10 4:14 pm,7/22/10 2:00 pm,Unknown person took wallet from unattended book bag / Unauthorized use of credit card reported,open,W0823,2010-07-22 16:14:00,exact,2010-07-22 14:00:00,2010-07-22 14:00:00
94,theft,924 e. 57th st. (bslc),7/22/10 9:12 pm,7/22/10 9:00 am to 9:00 pm,Unknown person took a bicycle that was chained to a bike rack,open,W0826,2010-07-22 21:12:00,range,2010-07-22 09:00:00,2010-07-22 21:00:00
95,robbery,woodlawn between 54th & 55th,7/22/10 9:28 pm,7/22/10 9:25 pm,"Four males grabbed man walking on the street, struck him and took his i-Pod before fleeing on foot",open,W0825,2010-07-22 21:28:00,exact,2010-07-22 21:25:00,2010-07-22 21:25:00
96,unlawful use of a weapon,61st at greenwood,7/21/10 2:01 pm,7/19/10 7:00 pm to 8:30 pm,Investigation of possible unlawful discharge of a firearm on the street by an unknown person,open,W0827,2010-07-21 14:01:00,range,2010-07-19 19:00:00,2010-07-19 20:30:00
97,cyberstalking,5841 s. maryland (mitchell hospital),7/23/10 8:37 am,7/16/10 9:33 pm,Report of receipt of annoying email,open,W0828,2010-07-23 08:37:00,exact,2010-07-16 21:33:00,2010-07-16 21:33:00
98,theft,blackstone between 50th & 51st st.,7/23/10 1:01 pm,7/23/10 12:45 pm,Man took cell phone from a youth on the street and refused to return it / UCPD officer located and arrested suspect / phone recovered,arrest,W0830,2010-07-23 13:01:00,exact,2010-07-23 12:45:00,2010-07-23 12:45:00
99,burglary,greenwood between 62nd & 63rd,7/23/10 1:25 pm,7/23/10 1:15 pm,Two males seen entering residence via window / Arrest,arrest,W0831,2010-07-23 13:25:00,exact,2010-07-23 13:15:00,2010-07-23 13:15:00
100,deceptive practice,924 e. 57th st (bslc),7/23/10 2:46 pm,7/21/10 1:00 pm,Unknown male caller used ruse in an attempt to secure credit card information from complainant,open,W0829,2010-07-23 14:46:00,exact,2010-07-21 13:00:00,2010-07-21 13:00:00
101,theft,5730 s. drexel (comer hospital),7/23/10 7:59 pm,7/23/10 4:30 pm to 7:30 pm,Unknown person took a bicycle that was secured to a bike rack,open,W0832,2010-07-23 19:59:00,range,2010-07-23 16:30:00,2010-07-23 19:30:00
102,irregular conditions,5640 s. university (bartlett commons),7/23/10 10:26 pm,7/23/10 10:26 pm,UCPD officer discovered an unlocked exterior door / Premise toured and secured,closed,W0833,2010-07-23 22:26:00,exact,2010-07-23 22:26:00,2010-07-23 22:26:00
104,irregular conditions,1100 e. 57th st. (regenstein library),7/23/10 11:57 pm,7/23/10 11:57 pm,Leak in basement due to heavy rain / Engineer notified,closed,W0835,2010-07-23 23:57:00,exact,2010-07-23 23:57:00,2010-07-23 23:57:00
106,fire alarm,5835 s. greenwood (stuart hall),7/24/10 7:27 am,7/24/10 7:27 am,Clogged drain on roof caused water leak that triggered alarm / CFD responded,closed,W0837,2010-07-24 07:27:00,exact,2010-07-24 07:27:00,2010-07-24 07:27:00
107,irregular conditions,various campus buildings,7/24/10 10:45 am,7/24/10 12:00:00 am to 10:00 am,Report of water leaks and flooding of several campus buildings due to heavy rains,closed,W0838,2010-07-24 10:45:00,range,2010-07-24 00:00:00,2010-07-24 10:00:00
108,irregular conditions,901 e. 58th st. (mitchell er),7/24/10 11:33 am,7/24/10 9:35 am,Power surge reported at Mitchell ER and several buildings on campus,closed,W0839,2010-07-24 11:33:00,exact,2010-07-24 09:35:00,2010-07-24 09:35:00
109,theft,greenwood at 53rd,7/24/10 1:38 pm,7/24/10 1:00 am to 6:00 am,Unknown person took unsecured bicycle from lobby of apartment building,open,W0840,2010-07-24 13:38:00,range,2010-07-24 01:00:00,2010-07-24 06:00:00
110,criminal damage to property,1125 e. 58th st.,7/24/10 2:56 pm,7/20/10 to 7/24/10 3:00 pm to 2:55 pm,Unknown person scrawled graffiti on two bulletin boards and a table in the Quad area / Facilities notified,open,W0841,2010-07-24 14:56:00,range,2010-07-20 15:00:00,2010-07-24 14:55:00
111,lost property,5815 s. maryland (mitchell hospital),7/24/10 7:07 pm,7/24/10 11:00 am to 7:05 pm,Patient reports a HP computer missing after she transferred rooms in the hospital,closed,W0842,2010-07-24 19:07:00,range,2010-07-24 11:00:00,2010-07-24 19:05:00
112,irregular conditions,5730 s. ellis (crerar library),7/24/10 9:44 pm,7/23/10 to 7/24/10 10:00 pm to 8:00 am,Doors to library were propped open with newspaper / UCPD conducted premise check,closed,W0843,2010-07-24 21:44:00,range,2010-07-23 22:00:00,2010-07-24 08:00:00
113,irregular conditions,6054 s. drexel (ucpd) / 6031 s. ellis (south campus res. hall),7/24/10 9:45 pm,7/24/10 9:45 pm,Power outage reported / ComEd restored power at 11:25 PM,closed,W0845,2010-07-24 21:45:00,exact,2010-07-24 21:45:00,2010-07-24 21:45:00
114,irregular conditions,1359 e. hyde park (fairfax),7/24/10 9:54 pm,7/24/10 9:54 pm,Person freed from stuck elevator by CFD,closed,W0844,2010-07-24 21:54:00,exact,2010-07-24 21:54:00,2010-07-24 21:54:00
115,theft,5730 s. drexel (comer er),7/25/10 12:55 am,7/24/10 to 7/25/10 11:30 pm to 12:55 am,Unknown person took credit cards and ID from an unattended wallet in Comer ER waiting area,open,W0846,2010-07-25 00:55:00,range,2010-07-24 23:30:00,2010-07-25 00:55:00
116,sick person,5630 s. university (max palevsky east),7/25/10 1:03 am,7/25/10 1:03 am,Sick person transported to Provident Hospital by CFD EMS,closed,W0847,2010-07-25 01:03:00,exact,2010-07-25 01:03:00,2010-07-25 01:03:00
117,found property,1116 e. 59th st. (harper library),7/25/10 7:47 am,7/25/10 7:47 am,UCPD officer found briefcase on bench / Owner contacted,closed,W0848,2010-07-25 07:47:00,exact,2010-07-25 07:47:00,2010-07-25 07:47:00
118,deceptive practice,woodlawn between 54th & 55th,7/25/10 8:08 am,7/22/10 10:00 pm,Complainant scammed via email / gave cnet ID and password to unknown party,open,W0849,2010-07-25 08:08:00,exact,2010-07-22 22:00:00,2010-07-22 22:00:00
119,possession of cannabis,5630 s. university (max palevsky east),7/25/10 10:12 am,7/25/10 10:12 am,Subject arrested for possession of marijuana,arrest,W0850,2010-07-25 10:12:00,exact,2010-07-25 10:12:00,2010-07-25 10:12:00
120,fire alarm,6031 s. ellis (south campus residence hall),7/25/10 11:23 am,7/25/10 11:23 am,Alarm malfunction / CFD responded,closed,W0851,2010-07-25 11:23:00,exact,2010-07-25 11:23:00,2010-07-25 11:23:00
121,miscellaneous,everett between 55th & 56th,7/25/10 1:19 pm,7/25/10 1:19 pm,UCPD officers came to aid of woman calling for help / No crime committed,closed,W0854,2010-07-25 13:19:00,exact,2010-07-25 13:19:00,2010-07-25 13:19:00
122,lost property,5815 s. maryland (mitchell hospital),7/25/10 1:41 pm,7/23/10 12:00 pm to 6:00 pm,Patient reports loss of eye glasses,closed,W0852,2010-07-25 13:41:00,range,2010-07-23 12:00:00,2010-07-23 18:00:00
123,theft,5815 s. maryland (mitchell hospital),7/25/10 2:11 pm,7/25/10 12:00 pm to 1:00 pm,Unattended wallet taken from table in café,open,W0853,2010-07-25 14:11:00,range,2010-07-25 12:00:00,2010-07-25 13:00:00
124,theft from person,55th at kimbark,7/25/10 4:45 pm,7/25/10 4:44 pm,Male exiting CTA bus grabbed cell phone from a passenger's hand and fled,open,W0855,2010-07-25 16:45:00,exact,2010-07-25 16:44:00,2010-07-25 16:44:00
125,irregular conditions,61st to 65th / cottage grove to university,7/25/10 11:25 pm,7/25/10 11:25 pm,Power outage caused by shorted switch / Power restored at 11:50 PM,closed,W0856,2010-07-25 23:25:00,exact,2010-07-25 23:25:00,2010-07-25 23:25:00
126,fire alarm,5835 s. greenwood (stuart hall),7/26/10 8:30 am,7/26/10 8:28 am,Condensation in line triggered fire alarm / CFD responded,closed,W0857,2010-07-26 08:30:00,exact,2010-07-26 08:28:00,2010-07-26 08:28:00
127,harassment by telephone,5848 s. university (kelly hall),7/26/10 9:05 am,1/29/10 to7/22/10 periodic,Report of on-going harassing telephone calls from a known individual / Investigation being conducted by CPD,closed,W0858,2010-07-26 09:05:00,range,2010-01-29 00:00:00,2010-07-22 23:59:00
128,lost property,924 e. 57th st. (bslc),7/26/10 4:31 pm,7/26/10 1:00 pm to 2:30 pm,Staff member reports losing her office keys,closed,W0859,2010-07-26 16:31:00,range,2010-07-26 13:00:00,2010-07-26 14:30:00
129,theft,969 e. 60th st. (ssa),7/27/10 12:10 pm,7/26/10 to 7/27/10 5:00 pm to 8:00 am,Unknown person cut U lock and took bicycle from bike rack,open,W0860,2010-07-27 12:10:00,range,2010-07-26 17:00:00,2010-07-27 08:00:00
130,theft,947 e. 58th st. (abbott memorial hall),7/27/10 3:02 pm,7/27/10 11:00 am to 12:30 pm,Unattended MacBook laptop computer taken from unlocked room,open,W0861,2010-07-27 15:02:00,range,2010-07-27 11:00:00,2010-07-27 12:30:00
131,information,901 e. 58th st. (ucmc er),7/27/10 7:28 pm,7/27/10 7:20 pm,Disagreement between two staff members,closed,W0862,2010-07-27 19:28:00,exact,2010-07-27 19:20:00,2010-07-27 19:20:00
132,theft,1100 e. 57th st. (regenstein library),7/27/10 8:35 pm,7/27/10 12:20 pm to 6:50 pm,Unknown person took secured bicycle from bike rack,open,W0863,2010-07-27 20:35:00,range,2010-07-27 12:20:00,2010-07-27 18:50:00
133,theft,1027 e. 57th st. (anatomy),7/27/10 11:44 pm,7/27/10 4:00 pm to 11:30 pm,Unknown person took bicycle secured to bike rack,open,W0864,2010-07-27 23:44:00,range,2010-07-27 16:00:00,2010-07-27 23:30:00
134,criminal damage to property,53rd between woodlawn & kimbark,7/28/10 7:48 am,7/28/10 12:30 am to 6:00 am,Unknown person shattered glass entrance door of restaurant with an unknown object,open,W0865,2010-07-28 07:48:00,range,2010-07-28 00:30:00,2010-07-28 06:00:00
135,assault,hyde park blvd. at 55th,7/28/10 9:17 am,7/26/10 9:50 pm,Unknown man followed woman and chased her into the lobby of her apartment building / No physical contact / No words exchanged,open,W0867,2010-07-28 09:17:00,exact,2010-07-26 21:50:00,2010-07-26 21:50:00
136,theft,969 e. 60th st. (ssa),7/28/10 9:43 am,7/27/10 to 7/28/10 5:00 pm to 8:00 am,Unknown person took secured bicycle from bike rack,open,W0866,2010-07-28 09:43:00,range,2010-07-27 17:00:00,2010-07-28 08:00:00
137,theft,1020 e. 58th st. (kent lab),7/28/10 12:15 pm,7/28/10 9:20 am to 12:05 pm,Secured bicycle taken from bike rack,open,W0868,2010-07-28 12:15:00,range,2010-07-28 09:20:00,2010-07-28 12:05:00
138,theft,5815 s. maryland (mitchell hospital),7/28/10 2:43 pm,7/28/10 2:15 pm,Wallet taken from woman's purse / Possibly in hallway or elevator,open,W0869,2010-07-28 14:43:00,exact,2010-07-28 14:15:00,2010-07-28 14:15:00
139,open door,5800 s. stony island (doctor's hospital),7/28/10 9:14 pm,7/28/10 9:14 pm,UCPD officer discovered an open door in the vacant building / Officers toured premises / No persons found,closed,W0870,2010-07-28 21:14:00,exact,2010-07-28 21:14:00,2010-07-28 21:14:00
140,theft,university between 55th & 56th,7/28/10 10:29 pm,7/28/10 7:10 pm to 10:25 pm,Unknown person took a bicycle that was secured to a metal post in front of a residential building,open,W0871,2010-07-28 22:29:00,range,2010-07-28 19:10:00,2010-07-28 22:25:00
141,fire alarm,5807 s. woodlawn (booth school),7/29/10 4:33 am,7/29/10 4:33 am,Apparent alarm malfunction / No smoke or fire / CFD responded,closed,W0872,2010-07-29 04:33:00,exact,2010-07-29 04:33:00,2010-07-29 04:33:00
142,arson,madison park between kenwood and dorchester,7/29/10 7:46 am,7/28/10 to 7/29/10 6:00 pm to 7:00 am,City garbage container and wooden fence damaged by fire,open,W0873,2010-07-29 07:46:00,range,2010-07-28 18:00:00,2010-07-29 07:00:00
144,theft,1101 e. 58th st. (rosenwald hall),7/29/10 8:52 am,7/28/10 8:00 am to 5:30 pm,Unknown person took bicycle that had been secured to bike rack,open,W0875,2010-07-29 08:52:00,range,2010-07-28 08:00:00,2010-07-28 17:30:00
145,telephone threat,860 e. 59th st. (goldblatt pavilion),7/29/10 9:30 am,7/28/10 1:00 pm,Woman felt threatened after receiving an anonymous phone call,open,W0876,2010-07-29 09:30:00,exact,2010-07-28 13:00:00,2010-07-28 13:00:00
146,irregular conditions,4444 s. evans (woodson charter school),7/29/10 10:56 am,7/29/10 9:45 am to 11:10 am,Power outage reported / Restore at 11:10 AM,closed,W0877,2010-07-29 10:56:00,range,2010-07-29 09:45:00,2010-07-29 11:10:00
147,assault,drexel at 50th,7/29/10 11:53 am,7/29/10 11:53 am,Woman walking on the street felt threatened by the actions of a stranger / Suspect gone upon arrival of police,open,W0878,2010-07-29 11:53:00,exact,2010-07-29 11:53:00,2010-07-29 11:53:00
148,theft from motor vehicle,cottage grove at 59th,7/29/10 1:23 pm,7/29/10 11:00 am,Unknown person smashed window of van parked on the street / Took GPS device and two Motorola portable radios,open,W0879,2010-07-29 13:23:00,exact,2010-07-29 11:00:00,2010-07-29 11:00:00
149,theft from motor vehicle,ellis at 55th,7/29/10 3:19 pm,7/29/10 8:45 am to 3:00 pm,Unknown person smashed window of car parked on the street / Took GPS device,open,W0880,2010-07-29 15:19:00,range,2010-07-29 08:45:00,2010-07-29 15:00:00
150,criminal damage to property,800 e. 55th st (friend center),7/29/10 4:32 pm,7/29/10 3:20 pm,Disgruntled man threw a door open causing a hole in the wall,open,W0882,2010-07-29 16:32:00,exact,2010-07-29 15:20:00,2010-07-29 15:20:00
151,theft,929 e. 57th st. (gordon center),7/29/10 4:33 pm,7/29/10 9:20 am to 4:15 pm,Unknown person took bicycle that had been secured to bike rack,open,W0881,2010-07-29 16:33:00,range,2010-07-29 09:20:00,2010-07-29 16:15:00
152,theft,kimbark between 57th & 58th,7/29/10 5:36 pm,7/28/10 to 7/29/10 8:00 am to 5:00 pm,Unknown person took bicycle that had been secured to a lamp post in the courtyard of residential building,open,W0883,2010-07-29 17:36:00,range,2010-07-28 08:00:00,2010-07-29 17:00:00
153,lost property,5758 s. maryland (dcam),7/29/10 5:54 pm,7/29/10 1:30 pm to 4:00 pm,Woman lost her wallet while in the cafeteria,closed,W0884,2010-07-29 17:54:00,range,2010-07-29 13:30:00,2010-07-29 16:00:00
154,theft from motor vehicle,shore dr. at 56th,7/29/10 7:14 pm,7/29/10 6:50 pm,Unknown female was seen entering an unlocked car parked on the street taking $5.00 in quarters,open,W0885,2010-07-29 19:14:00,exact,2010-07-29 18:50:00,2010-07-29 18:50:00
155,well-being check,kenwood between 56th & 57th,7/30/10 3:50 am,7/30/10 3:15 am,UCPD checked well-being of an individual at the request of a friend / All was well,closed,W0886,2010-07-30 03:50:00,exact,2010-07-30 03:15:00,2010-07-30 03:15:00
156,theft,55th between cornell and hyde park,7/30/10 12:13 pm,7/30/10 12:10 pm,Unknown male customer grabbed money from cash register as salesperson was making change / Suspect fled on foot,open,W0887,2010-07-30 12:13:00,exact,2010-07-30 12:10:00,2010-07-30 12:10:00
158,theft,1115 e. 58th st. (walker),7/30/10 3:05 pm,7/30/10 2:00 pm to 3:00 pm,Two bicycles chained together were taken from bike rack,open,W0890,2010-07-30 15:05:00,range,2010-07-30 14:00:00,2010-07-30 15:00:00
159,theft,5812 s. ellis (brain research),7/30/10 4:05 pm,7/30/10 9:00 am to 3:45 pm,Unknown person took secured bicycle from bike rack,open,W0889,2010-07-30 16:05:00,range,2010-07-30 09:00:00,2010-07-30 15:45:00
160,theft,1126 e. 59th st. (social science),7/30/10 8:46 pm,7/30/10 3:30 pm to 5:30 pm,Unknown person used a tool to cut bar on bike rack and took a secured bicycle,open,W0891,2010-07-30 20:46:00,range,2010-07-30 15:30:00,2010-07-30 17:30:00
161,burglary,57th between harper & lake park,7/31/10 2:11 am,7/30/10 to 7/31/10 10:30 pm to 2:00 am,"Unknown person(s) gained entry to residential apartment by undetermined method taking an Acer laptop computer, jewelry box and jewelry",open,W0892,2010-07-31 02:11:00,range,2010-07-30 22:30:00,2010-07-31 02:00:00
162,burglary,52nd between greenwood & university,7/31/10 2:20 am,7/30/10 to 7/31/10 8:30 pm to 1:45 am,"Entry gained to residential apartment via front window / 3 computers, $175 in coins, medical equipment taken by unknown person(s)",open,W0893,2010-07-31 02:20:00,range,2010-07-30 20:30:00,2010-07-31 01:45:00
163,criminal damage to property,5730 s. ellis (crerar library),7/31/10 3:32 pm,7/30/10 to 7/31/10 6:00 pm to 3:30 pm,Unknown person scrawled graffiti on exterior wall / Facilities notified,open,W0894,2010-07-31 15:32:00,range,2010-07-30 18:00:00,2010-07-31 15:30:00
164,criminal damage to property,5630 s. university (max palevsky east),7/31/10 5:20 pm,7/30/10 to 7/31/10 11:00 pm to 8:00 am,Unknown person scrawled graffiti on exterior wall / Facilities notified,open,W0895,2010-07-31 17:20:00,range,2010-07-30 23:00:00,2010-07-31 08:00:00
165,theft from motor vehicle,drexel between 52nd & 53rd,8/1/10 9:22 am,7/31/10 to 8/1/10 9:00 pm to 9:15 am,Unknown person smashed window of car parked on the street / Took GPS device,open,W0896,2010-08-01 09:22:00,range,2010-07-31 21:00:00,2010-08-01 09:15:00
166,fire alarm,5530 s. ellis (ratner ac),8/1/10 10:42 am,8/1/10 10:42 am,Alarm malfunction / CFD responded,closed,W0897,2010-08-01 10:42:00,exact,2010-08-01 10:42:00,2010-08-01 10:42:00
167,fire alarm,5807 s. woodlawn (booth school),8/1/10 11:00 pm,8/1/10 11:00 pm,Alarm malfunction / CFD responded,closed,W0898,2010-08-01 23:00:00,exact,2010-08-01 23:00:00,2010-08-01 23:00:00
168,burglary,1427 e. 60th st. (press office),8/2/10 9:24 am,7/29/10 to 8/2/10 6:00 pm to 8:45 am,Unknown person broke office window / Dell laptop computer and docking station taken from desk top,open,W0899,2010-08-02 09:24:00,range,2010-07-29 18:00:00,2010-08-02 08:45:00
169,theft,ellis between 60th & 61st,8/2/10 12:03 pm,8/1/10 unknown,CPD arrested a man wanted on a warrant and found him in possession of a stolen bicycle / Bike turned over to UCPD being held for owner,closed,W0900,2010-08-02 12:03:00,range,2010-08-01 00:00:00,2010-08-01 23:59:00
170,theft from motor vehicle,61st between cottage grove & drexel,8/2/10 1:27 pm,8/2/10 7:45 am to 1:15 pm,Unknown person smashed window of vehicle parked in vacant lot and took a GPS device,open,W0901,2010-08-02 13:27:00,range,2010-08-02 07:45:00,2010-08-02 13:15:00
171,theft from motor vehicle,blackstone at 51st,8/2/10 1:55 pm,8/1/10 to 8/2/10 4:00 pm to 12:30 pm,Unknown person smashed window of car in parking lot and took a GPS device,open,W0903,2010-08-02 13:55:00,range,2010-08-01 16:00:00,2010-08-02 12:30:00
172,found property,harper between 58th & 59th,8/2/10 1:56 pm,8/2/10 1:56 pm,Bag containing electronic equipment found on the street and turned over to UCPD / Property being held by CPD,closed,W0902,2010-08-02 13:56:00,exact,2010-08-02 13:56:00,2010-08-02 13:56:00
173,theft of lost or mislaid property,1100 e. 57th st. (regenstein library),8/2/10 5:46 pm,8/2/10 5:30 pm,UCPD officers observed two males attempting to take bicycle from bike rack / Had stolen property in their possession / Arrest by UCPD,arrest,W0904,2010-08-02 17:46:00,exact,2010-08-02 17:30:00,2010-08-02 17:30:00
174,domestic battery,cottage grove between 63rd & 64th,8/2/10 7:03 pm,8/2/10 6:40 pm,Male subject punched female in the course of an argument on the street / Arrest by UCPD,arrest,W0905,2010-08-02 19:03:00,exact,2010-08-02 18:40:00,2010-08-02 18:40:00
175,theft,5815 s. maryland (mitchell hospital),8/3/10 10:58 am,7/29/10 to 8/2/10 2:00 pm to 1:00 pm,"2 rings, necklace, and $10 cash taken from purse in patient's room",open,W0906,2010-08-03 10:58:00,range,2010-07-29 14:00:00,2010-08-02 13:00:00
176,harassment by electronic means,50th between cornell & shore dr.,8/3/10 4:01 pm,8/3/10 12:45 am,Complainant reported a series of harassing email messages and phone calls from a former girlfriend,open,W0907,2010-08-03 16:01:00,exact,2010-08-03 00:45:00,2010-08-03 00:45:00
177,theft,1427 e. 60th st. (press building),8/3/10 5:04 pm,8/3/10 1:30 pm to 5:00 pm,Unknown person took secured bicycle from bike rack,open,W0908,2010-08-03 17:04:00,range,2010-08-03 13:30:00,2010-08-03 17:00:00
178,suspicious package,1526 e. 55th st. (hyde park shopping ctr.),8/3/10 10:59 pm,8/3/10 10:59 pm,Suspicious suitcase found outside door of a store / CPD Bomb and Arson notified / Suitcase contained garbage,closed,W0909,2010-08-03 22:59:00,exact,2010-08-03 22:59:00,2010-08-03 22:59:00
180,theft,5841 s. maryland (ucmc),8/4/10 2:36 pm,8/4/10 2:00 pm to 2:05 pm,"Unknown person took an unattended fanny pack from patient's room / contained a wallet, cell phone, check book / Unauthorized use of a credit card subsequently reported",open,W0911,2010-08-04 14:36:00,range,2010-08-04 14:00:00,2010-08-04 14:05:00
181,criminal damage to property,5825 s. dorchester (stein place),8/4/10 6:39 pm,8/4/10 5:00 pm to 5:50 pm,Unknown person damaged bottom panel of overhead garage door,open,W0913,2010-08-04 18:39:00,range,2010-08-04 17:00:00,2010-08-04 17:50:00
182,lost property,5800 s. stony island (doctors hospital),8/4/10 6:45 pm,7/18/10 12:40 pm,Radiation sensor lost while working at the site,closed,W0912,2010-08-04 18:45:00,exact,2010-07-18 12:40:00,2010-07-18 12:40:00
183,criminal damage to property,6016 s. ingleside (midway studios),8/5/10 12:29 pm,8/4/10 to 8/5/10 5:00 pm to 8:30 am,Unknown person pushed on window grate causing damage to a file cabinet that tipped over,open,W0914,2010-08-05 12:29:00,range,2010-08-04 17:00:00,2010-08-05 08:30:00
184,miscellaneous,5659 s. ellis (construction site),8/6/10 5:35 am,8/3/10 10:00 am,Two construction workers involved in heated argument / Worker escorted from site by UCPD / Peace restored,closed,W0916,2010-08-06 05:35:00,exact,2010-08-03 10:00:00,2010-08-03 10:00:00
185,theft from motor vehicle,kimbark between 53rd & 54th,8/6/10 8:32 am,8/5/10 to 8/6/10 10:00 pm to 8:30 am,Unknown person smashed window of car parked on the street / Took GPS device and sunglasses,open,W0915,2010-08-06 08:32:00,range,2010-08-05 22:00:00,2010-08-06 08:30:00
186,theft,5815 s. maryland (mitchell hospital),8/6/10 11:56 am,7/31/10 3:00 am to 2:00 pm,Unknown person took HP laptop computer from patient's room,open,W0917,2010-08-06 11:56:00,range,2010-07-31 03:00:00,2010-07-31 14:00:00
187,injured person,929 e. 57th st. (gordon center),8/6/10 1:14 pm,8/6/10 1:10 pm,Chemical splashed in man's eyes during the course of an experiment / Transported to hospital by CFD EMS,closed,W0918,2010-08-06 13:14:00,exact,2010-08-06 13:10:00,2010-08-06 13:10:00
188,theft,935 e. 56th st. (high energy physics bldg.),8/6/10 2:19 pm,8/6/10 2:00 pm to 2:19 pm,Unknown person took unattended Mac laptop computer from unlocked office,open,W0919,2010-08-06 14:19:00,range,2010-08-06 14:00:00,2010-08-06 14:19:00
189,theft,940 e. 57th st. (bio-psych. bldg.),8/6/10 4:27 pm,8/2/10 4:00 pm,Unknown person took wireless device from office,open,W0920,2010-08-06 16:27:00,exact,2010-08-02 16:00:00,2010-08-02 16:00:00
190,irregular conditions,5706 s. university (reynolds club),8/6/10 10:53 pm,8/6/10 10:53 pm,Officer found unlocked door during a premise check / Engineer notified,closed,W0921,2010-08-06 22:53:00,exact,2010-08-06 22:53:00,2010-08-06 22:53:00
191,criminal damage to vehicle,48th between woodlawn & kimbark,8/7/10 8:01 am,8/6/10 to 8/7/10 7:30 pm to 6:30 am,Unknown person slashed three tires on a car parked on the street,open,W0922,2010-08-07 08:01:00,range,2010-08-06 19:30:00,2010-08-07 06:30:00
192,theft from motor vehicle,university at 59th,8/7/10 12:45 pm,8/5/10 to 8/7/10 11:00 pm to 12:40 pm,Unknown person smashed window of car parked on the street and took a GPS device,open,W0923,2010-08-07 12:45:00,range,2010-08-05 23:00:00,2010-08-07 12:40:00
193,theft from motor vehicle,60th between greenwood & university,8/7/10 2:12 pm,8/7/10 1:40 pm to 2:00 pm,Unknown person removed lock from the rear door of a workman's van parked on the street and took construction tools,open,W0924,2010-08-07 14:12:00,range,2010-08-07 13:40:00,2010-08-07 14:00:00
194,disturbance,56th between woodlawn & kimbark,8/8/10 1:41 am,8/8/10 1:41 am,Residents complained about a loud party in a residence / Peace restored,closed,W0925,2010-08-08 01:41:00,exact,2010-08-08 01:41:00,2010-08-08 01:41:00
195,disturbance,kimbark between 57th & 58th,8/8/10 5:09 am,8/8/10 5:09 am,Residents complained of loud noise coming from a group of people in a limo parked on the street / Peace restored,closed,W0926,2010-08-08 05:09:00,exact,2010-08-08 05:09:00,2010-08-08 05:09:00
196,theft from motor vehicle,dorchester at 57th,8/8/10 8:58 pm,8/8/10 7:15 pm to 8:45 pm,Unknown person smashed window of car parked on the street and took GPS device,open,W0927,2010-08-08 20:58:00,range,2010-08-08 19:15:00,2010-08-08 20:45:00
197,theft,5530 s. ellis (ratner ac),8/9/10 10:13 am,8/6/10 6:00 pm to 6:30 pm,Man left student ID card unattended while exercising / Unknown person took ID card,open,W0928,2010-08-09 10:13:00,range,2010-08-06 18:00:00,2010-08-06 18:30:00
198,deceptive practice,52nd between kimbark & kenwood,8/9/10 11:25 am,8/7/10 6:30 am,Unknown person attempted to scam money from complainant via email,open,W0929,2010-08-09 11:25:00,exact,2010-08-07 06:30:00,2010-08-07 06:30:00
199,disturbance,860 e. 59th st. (goldblatt pavilion),8/9/10 12:22 pm,8/9/10 7:30 am,Verbal altercation between two staff members / Peace restored,closed,W0930,2010-08-09 12:22:00,exact,2010-08-09 07:30:00,2010-08-09 07:30:00
200,damage to property,6054 s. drexel (ucpd),8/9/10 6:30 pm,8/9/10 7:00 am,Damage found on University owned vehicle parked in parking structure,closed,W0934,2010-08-09 18:30:00,exact,2010-08-09 07:00:00,2010-08-09 07:00:00
201,attempt theft,6058 s. ellis (edelstone parking lot),8/9/10 7:38 pm,8/9/10 7:38 pm,UCPD officer arrested male subject in the process of cutting copper wire attached to gate box,arrest,W0931,2010-08-09 19:38:00,exact,2010-08-09 19:38:00,2010-08-09 19:38:00
202,theft,cottage grove at 58th,8/9/10 8:45 pm,8/9/10 6:00 am to 8:30 pm,Unknown person smashed rear passenger's side window of car parked on the street and took a GPS device,open,W0932,2010-08-09 20:45:00,range,2010-08-09 06:00:00,2010-08-09 20:30:00
203,irregular conditions,6054 s. drexel (ucpd),8/9/10 11:34 pm,8/9/10 11:34 pm,Handicap door in lobby of building could not be properly secured / Facilities notified,closed,W0933,2010-08-09 23:34:00,exact,2010-08-09 23:34:00,2010-08-09 23:34:00
204,warrant arrest,stony island at 63rd,8/10/10 4:30 am,8/10/10 4:30 am,UCPD officers arrested a male subject wanted on a warrant,arrest,W0935,2010-08-10 04:30:00,exact,2010-08-10 04:30:00,2010-08-10 04:30:00
205,aggravated battery,cottage grove at 62nd,8/10/10 9:15 am,8/10/10 9:15 am,Male subject shot in the left leg after an argument with another male subject on the street / Transported to hospital by CFD EMS,open,W0936,2010-08-10 09:15:00,exact,2010-08-10 09:15:00,2010-08-10 09:15:00
206,criminal damage to vehicle,woodlawn between 49th & 50th,8/10/10 10:53 am,8/7/10 to 8/8/10 10:00 pm to 5:00 am,Unknown person slashed four tires on a car parked on the street,open,W0937,2010-08-10 10:53:00,range,2010-08-07 22:00:00,2010-08-08 05:00:00
207,missing person,970 e. 58th st. (bookstore),8/10/10 11:13 am,8/10/10 10:00 am,"Family reported man, suffering from illness, wandered off and could not be located / Man later found and escorted home by UCPD",closed,W0938,2010-08-10 11:13:00,exact,2010-08-10 10:00:00,2010-08-10 10:00:00
208,theft,5841 s. cottage grove (general stores),8/10/10 11:46 am,8/10/10 7:00 am to 7:45 am,Unknown person took DVD disk from office,open,W0940,2010-08-10 11:46:00,range,2010-08-10 07:00:00,2010-08-10 07:45:00
209,theft from motor vehicle,kenwood between 57th & 58th,8/10/10 12:26 pm,8/9/10 to 8/10/10 8:00 pm to 11:45 am,Unknown person smashed the driver's side window of a car parked on the street and took a GPS device,open,W0939,2010-08-10 12:26:00,range,2010-08-09 20:00:00,2010-08-10 11:45:00
210,found property,langley between 61st & 62nd,8/10/10 4:19 pm,8/10/10 3:25 pm,UCPD officers chased an unknown suspect who abandoned a Canon digital camera and an Olympus voice recorder while fleeing,closed,W0941,2010-08-10 16:19:00,exact,2010-08-10 15:25:00,2010-08-10 15:25:00
211,theft from motor vehicle,woodlawn between 58th & 59th,8/10/10 5:08 pm,8/10/10 7:25 am to 4:30 pm,Unknown person smashed passenger's side window of car parked on the street and took a gym bag,open,W0942,2010-08-10 17:08:00,range,2010-08-10 07:25:00,2010-08-10 16:30:00
212,possession of lost or stolen property,harper between 54th & 55th,8/10/10 11:38 pm,8/10/10 11:35 pm,UCPD officer arrested man for possession of a stolen bicycle / Owner of bike not known at the time,arrest,W0943,2010-08-10 23:38:00,exact,2010-08-10 23:35:00,2010-08-10 23:35:00
213,injured person,5841 s. cottage grove (materials mgt.),8/11/10 5:29 am,8/11/10 5:00 am,Deliveryman fell from loading dock and fractured his left ankle / Transported to ER by CFD EMS,closed,W0944,2010-08-11 05:29:00,exact,2010-08-11 05:00:00,2010-08-11 05:00:00
214,theft from motor vehicle,59th & payne dr.,8/11/10 12:12 pm,8/10/10 8:00 am to 5:30 pm,Unknown person smashed window of vehicle parked on the street and took a GPS device,open,W0945,2010-08-11 12:12:00,range,2010-08-10 08:00:00,2010-08-10 17:30:00
215,injured person,5815 s. maryland (mitchell hosp.),8/11/10 1:18 pm,8/11/10 1:10 pm,Woman injured her finger when it became caught in the metal support of a chair / Treated at ER,closed,W0946,2010-08-11 13:18:00,exact,2010-08-11 13:10:00,2010-08-11 13:10:00
216,theft,1101 e. 58th st. (rosenwald),8/11/10 2:10 pm,7/30/10 to 8/3/10 5:00 pm to 10:00 am,Unknown person removed a MacBook Pro computer from under a podium in an unsecured lecture hall,open,W0947,2010-08-11 14:10:00,range,2010-07-30 17:00:00,2010-08-03 10:00:00
217,battery,57th between greenwood & university,8/11/10 2:24 pm,8/11/10 2:15 pm,A male and two females involved in an argument that resulted in physical contact by all involved / All three refused to sign complaints / Peace restored,closed,W0948,2010-08-11 14:24:00,exact,2010-08-11 14:15:00,2010-08-11 14:15:00
218,injured person,5815 s. maryland (mitchell er),8/11/10 2:15 pm,8/6/10 unknown,Woman said she tripped over a chair in the ER and fell on her back / Delayed report,closed,W0949,2010-08-11 14:15:00,range,2010-08-06 00:00:00,2010-08-06 23:59:00
219,assault,970 e. 58th st. (bookstore),8/11/10 6:39 pm,8/11/10 5:20 pm,Employee reports a co-worker verbally threatened her causing her to fear for her safety,open,W0950,2010-08-11 18:39:00,exact,2010-08-11 17:20:00,2010-08-11 17:20:00
221,miscellaneous,5815 s. maryland (mitchell hosp.),8/12/10 10:40 am,8/12/10 9:30 am,Patient left the hospital without being properly released,closed,W0952,2010-08-12 10:40:00,exact,2010-08-12 09:30:00,2010-08-12 09:30:00
222,theft,800 e. 55th st. (friend center),8/12/10 1:41 pm,8/12/10 12:00 pm to 1:10 pm,Unknown person took an unattended cell phone from an examination room,open,W0954,2010-08-12 13:41:00,range,2010-08-12 12:00:00,2010-08-12 13:10:00
223,theft,970 e. 59th st. (mclean inst.),8/12/10 2:05 pm,4/1/10 to 8/4/10 8:00 am to 5:00 pm,Leica light microscope taken from secured room,open,W0953,2010-08-12 14:05:00,range,2010-04-01 08:00:00,2010-08-04 17:00:00
224,burglary,oakenwald between 40th & 41st,8/12/10 6:17 pm,8/12/10 6:15 pm,Resident reports she saw 10-15 unknown male & female teens run from her home while she was in rear yard / $300 and two bottles of wine taken / No sign of forced entry,open,W0955,2010-08-12 18:17:00,exact,2010-08-12 18:15:00,2010-08-12 18:15:00
225,violation of order of protection,5721 s. maryland (comer hospital),8/12/10 8:33 pm,8/12/10 7:45 pm,Woman visiting child reported child's father violated order of protection by visiting while she was present,closed,W0956,2010-08-12 20:33:00,exact,2010-08-12 19:45:00,2010-08-12 19:45:00
226,irregular conditions,5640 s. university (bartlett commons),8/13/10 1:23,8/13/10 1:23 am,UCPD unit found exterior door of building unlocked / Checked premise / All secure,closed,W0957,2010-08-13 01:23:00,exact,2010-08-13 01:23:00,2010-08-13 01:23:00
227,burglary,ellis between 54th & 55th,8/13/10 4:21 am,8/13/10 4:20 am,"Resident awaked to find an unknown man standing in the kitchen / when observed, suspect fled out rear door / entry made via open window",open,W0958,2010-08-13 04:21:00,exact,2010-08-13 04:20:00,2010-08-13 04:20:00
228,disturbance,5841 s. maryland (mitchell hospital),8/13/10 7:32 am,8/13/10 7:32 am,Anonymous person placed a call that a man was displaying a handgun in a hospital office / No person found / Anonymous caller not found,unfounded,W0959,2010-08-13 07:32:00,exact,2010-08-13 07:32:00,2010-08-13 07:32:00
229,burglary,55th pl. between blackstone & harper,8/13/10 8:13 am,8/12/10 to 8/13/10 11:00 pm to 7:30 am,"Unknown person(s) gained entry to residence via broken window / Took TV, computers, cell phone, wallet, keys / Honda Odyssey taken from street",open,W0960,2010-08-13 08:13:00,range,2010-08-12 23:00:00,2010-08-13 07:30:00
230,theft,1212 e. 59th st. (ida noyes),8/13/10 2:22 pm,8/10/10 to 8/13/10 12:00 pm to 12:00 pm,Unknown person took secured bicycle from bike rack,open,W0961,2010-08-13 14:22:00,range,2010-08-10 12:00:00,2010-08-13 12:00:00
231,attempt theft,out of area 541 e. 63rd st.,8/13/10 11:40 pm,8/13/10 10:30 pm,Male subject attempted to pick complainant's pocket while on the sidewalk,out of area cpd case,W0962,2010-08-13 23:40:00,exact,2010-08-13 22:30:00,2010-08-13 22:30:00
232,battery,dorchester at 58th,8/14/10 9:33 pm,8/14/10 9:15 pm,Unknown male grabbed a man walking on the sidewalk tearing his shirt / Suspect fled when victim activated his vehicle alarm,open,W0963,2010-08-14 21:33:00,exact,2010-08-14 21:15:00,2010-08-14 21:15:00
233,homicide,out of area - 60th & cottage grove,8/15/10 12:06 am,8/15/10 12:01 am,Man on the street shot and killed by another man / Suspect detained by CPD detectives,cpd investigation,W0964,2010-08-15 00:06:00,exact,2010-08-15 00:01:00,2010-08-15 00:01:00
234,theft,harper between 57th & 58th,8/15/10 3:27 pm,8/15/10 3:27 pm,Male subject took bicycle from the rear of a building / Arrest by UCPD,arrest,W0965,2010-08-15 15:27:00,exact,2010-08-15 15:27:00,2010-08-15 15:27:00
235,found property,1111 e. 60th st. (law school),8/16/10 7:48 am,8/11/10 unknown,Staff member found expended bullet near the reflecting pool on the Law School grounds / Turned over to CPD,closed,W0966,2010-08-16 07:48:00,range,2010-08-11 00:00:00,2010-08-11 23:59:00
236,criminal damage to property,1101 e. 56th st (max palevsky central),8/16/10 8:49 am,8/16/10 8:49 am,Graffiti scrawled on fire exit door of the building / Facilities notified for removal,closed,W0967,2010-08-16 08:49:00,exact,2010-08-16 08:49:00,2010-08-16 08:49:00
237,criminal damage to vehicle,5555 s. ellis (young parking lot),8/16/10 9:56 am,8/13/10 to 8/16/10 4:30 pm to 6:45 am,Driver's side view mirror of University owned van was forcibly removed from the vehicle,open,W0968,2010-08-16 09:56:00,range,2010-08-13 16:30:00,2010-08-16 06:45:00
238,information,university between 55th & 56th,8/16/10 2:00 pm,8/13/10 5:00 pm,"Woman reports a male subject in a vehicle parked on the street may have been fondling himself, but she was not certain",open,W0969,2010-08-16 14:00:00,exact,2010-08-13 17:00:00,2010-08-13 17:00:00
239,theft,harper at 52nd,8/16/10 5:42 pm,8/16/10 5:40 pm,UCPD officers arrested a male subject shortly after he took a bicycle parked on the street / Property returned to owner,arrest,W0970,2010-08-16 17:42:00,exact,2010-08-16 17:40:00,2010-08-16 17:40:00
240,theft,58th between kimbark & kenwood,8/16/10 5:59 pm,7/5/10 to 8/16/10 12:00 pm to 1:00 pm,Unknown person(s) took copper downspouts from building,open,W0972,2010-08-16 17:59:00,range,2010-07-05 12:00:00,2010-08-16 13:00:00
241,burglary,kenwood between 54th & 55th,8/16/10 6:55 pm,8/16/10 9:20 am to 5:50 pm,Unknown person broke rear window to gain entry to residence / Took 2 digital cameras and jewelry,open,W0971,2010-08-16 18:55:00,range,2010-08-16 09:20:00,2010-08-16 17:50:00
242,found property,ingleside at 62nd,8/16/10 9:13 pm,8/16/10 9:13 pm,UCPD officers found a handgun hidden in a tree planter on the street / Turned over to CPD for processing,closed,W0974,2010-08-16 21:13:00,exact,2010-08-16 21:13:00,2010-08-16 21:13:00
243,burglary,52nd between woodlawn & kimbark,8/16/10 10:05 pm,8/16/10 9:30 pm to10:00 pm,Unknown person gained entry to apartment via an open window / Took Dell Laptop computer & i-Pod,open,W0973,2010-08-16 22:05:00,range,2010-08-16 21:30:00,2010-08-16 22:00:00
244,burglary,woodlawn at 54th,8/17/10 12:01 am,8/16/10 11:55 pm,Resident arrived at home to find an unknown male in his apartment / Suspect fled via an open window,open,W0975,2010-08-17 00:01:00,exact,2010-08-16 23:55:00,2010-08-16 23:55:00
245,burglary,ellis between 54th & 55th,8/17/10 9:00 am,8/16/10 to 8/17/10 7:00 pm to 8:30 am,Unknown person gained entry to apartment via an unlocked window and took $15 cash,open,W0976,2010-08-17 09:00:00,range,2010-08-16 19:00:00,2010-08-17 08:30:00
246,theft,5758 s. maryland (dcam),8/17/10 4:02 pm,8/17/10 1:15 pm to 1:30 pm,Unknown person took $640 cash from unattended purse in women's washroom,open,W0977,2010-08-17 16:02:00,range,2010-08-17 13:15:00,2010-08-17 13:30:00
247,theft,greenwood between 53rd & 54th,8/17/10 7:03 pm,8/16/10 to 8/17/10 4:00 pm to 11:00 am,"Bicycle was secured to a light pole / Unknown person took frame and rear wheel, leaving front wheel secured to the pole",open,W0978,2010-08-17 19:03:00,range,2010-08-16 16:00:00,2010-08-17 11:00:00
248,burglary,54th pl. between ingleside & ellis,8/17/10 10:51 pm,8/17/10 8:30 am to 10:45 pm,Unknown person pulled air conditioner from window to gain entry to apartment / Took jewelry box and jewelry,open,W0979,2010-08-17 22:51:00,range,2010-08-17 08:30:00,2010-08-17 22:45:00
249,theft,901 e. 58th st. (mitchell er),8/18/10 1:07 pm,8/18/10 9:00 am to 10:00 am,Patient reports unknown person took $20 from his unattended wallet,open,W0980,2010-08-18 13:07:00,range,2010-08-18 09:00:00,2010-08-18 10:00:00
250,theft,53rd between hyde park & south shore dr.,8/18/10 2:09 pm,8/16/10 to 8/17/10 3:00 pm to 12:00 pm,Unknown person cut cable and took bicycle from bike rack on the street,open,W0981,2010-08-18 14:09:00,range,2010-08-16 15:00:00,2010-08-17 12:00:00
251,aggravated battery,62nd between cottage grove & drexel,8/18/10 3:13 pm,8/18/10 3:10 pm,Man walking on the street shot in the leg by one of two unknown suspects / Transported to hospital by CFD EMS,open,W0982,2010-08-18 15:13:00,exact,2010-08-18 15:10:00,2010-08-18 15:10:00
252,reckless conduct,ingleside at 62nd,8/18/10 5:25 pm,8/18/10 5:25 pm,UCPD officers arrested a man who incited a group and threatened police officers,arrest,W0983,2010-08-18 17:25:00,exact,2010-08-18 17:25:00,2010-08-18 17:25:00
253,indecent exposure,59th near blackstone,8/19/10 8:03 am,8/18/10 8:00 pm,Complainant observed male riding a bicycle exposing himself,open,W0984,2010-08-19 08:03:00,exact,2010-08-18 20:00:00,2010-08-18 20:00:00
254,miscellaneous,6054 s. drexel (ucpd hq),8/19/10 8:35 am,8/19/10 8:35 am,Person banned from University property telephoned stating his intentions to visit / Advised he is subject to arrest if he does so,closed,W0986,2010-08-19 08:35:00,exact,2010-08-19 08:35:00,2010-08-19 08:35:00
255,theft,5747 s. ellis (quad),8/19/10 9:32 am,8/18/10 8:30 am to 6:00 pm,Unknown person took secured bicycle from bike rack,open,W0985,2010-08-19 09:32:00,range,2010-08-18 08:30:00,2010-08-18 18:00:00
256,warrant arrest,maryland at 54th,8/19/10 5:38 pm,8/19/10 5:38 pm,UCPD officers arrested a man wanted on a warrant,arrest,W0987,2010-08-19 17:38:00,exact,2010-08-19 17:38:00,2010-08-19 17:38:00
257,robbery,drexel at 62nd,8/19/10 8:21 pm,8/19/10 8:15 pm,"Two males struck a male in the face, took his cell phone and fled / UCPD officer arrested suspects shortly thereafter",arrest,W0988,2010-08-19 20:21:00,exact,2010-08-19 20:15:00,2010-08-19 20:15:00
258,battery,blackstone at 52nd,8/19/10 8:59 pm,8/19/10 8:50 pm,Unknown male grabbed woman from behind on the sidewalk / Suspect fled when woman yelled at him,open,W0989,2010-08-19 20:59:00,exact,2010-08-19 20:50:00,2010-08-19 20:50:00
259,aggravated robbery,55th between cornell & hyde park,8/19/10 11:24 pm,8/19/10 11:15 pm,"Unknown male entered store, implied he had a gun / Took $200 from cash register and fled",open,W0990,2010-08-19 23:24:00,exact,2010-08-19 23:15:00,2010-08-19 23:15:00
260,suspicious activity,5514 s. university (pierce hall),8/20/10 11:35 am,8/20/10 12:05 am,Three unknown males climbed fire escape and knocked on doors to gain entry,closed,W0991,2010-08-20 11:35:00,exact,2010-08-20 00:05:00,2010-08-20 00:05:00
261,injured person,cottage grove at 61st,8/20/10 12:48 pm,8/20/10 12:48 pm,Two staff members injured in traffic crash / One treated and released at Mitchell ER,closed,W0992,2010-08-20 12:48:00,exact,2010-08-20 12:48:00,2010-08-20 12:48:00
262,criminal damage to property,1025 e. 58th st. (bond chapel),8/20/10 2:10 pm,8/20/10 2:00 pm,Man became upset and kicked a pew damaging same / Arrest by UCPD,arrest,W0993,2010-08-20 14:10:00,exact,2010-08-20 14:00:00,2010-08-20 14:00:00
263,theft of motor vehicle,midway pl. between woodlawn & kimbark,8/20/10 4:31 pm,8/18/10 12:30 pm to 3:30 pm,Unknown person took a black 1987 Olds Cutlass parked on the street,open,W0994,2010-08-20 16:31:00,range,2010-08-18 12:30:00,2010-08-18 15:30:00
264,criminal sexual abuse,5815 s. maryland (mitchell hospital),8/20/10 5:00 pm,8/16/10 to 8/18/10 unknown,"Female patient, who cannot communicate verbally, used another method of communication to indicate she was fondled by an unknown male / Investigation continues",open,W0996,2010-08-20 17:00:00,range,2010-08-16 00:00:00,2010-08-18 23:59:00
265,theft,1100 e. 58th st. (ryerson laboratory),8/20/10 7:08 pm,8/20/10 3:30 pm to 4:00 pm,Unattended Blackberry taken from desk in unsecured office,open,W0995,2010-08-20 19:08:00,range,2010-08-20 15:30:00,2010-08-20 16:00:00
266,activated alarm,1362 e. 59th st. (blaine hall),8/21/10 4:57 am,8/21/10 4:57 am,Security alarm activated / UCPD conducted premises check / All secure,closed,W0997,2010-08-21 04:57:00,exact,2010-08-21 04:57:00,2010-08-21 04:57:00
267,irregular conditions,5800 s. stony island (doctors hospital),8/21/10 12:34 pm,8/21/10 12:34 pm,UCPD officer found exterior door unlocked,closed,W0998,2010-08-21 12:34:00,exact,2010-08-21 12:34:00,2010-08-21 12:34:00
268,criminal trespass to property,6019 s. dorchester (construction site),8/21/10 2:55 pm,8/21/10 2:30 pm,Man climbed boom of crane at construction site (apprx. 200 ft.) / CPD negotiator communicated with the man / Taken to hospital for psychological exam,closed,W0999,2010-08-21 14:55:00,exact,2010-08-21 14:30:00,2010-08-21 14:30:00
269,warrant arrest,50th & cornell,8/21/10 8:43 pm,8/21/10 8:43 pm,UCPD officers arrested a man wanted on a warrant for violation of parole,arrest,W1000,2010-08-21 20:43:00,exact,2010-08-21 20:43:00,2010-08-21 20:43:00
270,theft,53rd at dorchester,8/22/10 9:20 am,8/21/10 11:00 pm,Unknown person took unsecured bicycle parked on the sidewalk in front of store,open,W1001,2010-08-22 09:20:00,exact,2010-08-21 23:00:00,2010-08-21 23:00:00
271,unlawful use of a weapon,cottage grove at 59th,8/22/10 11:00 am,8/22/10 10:50 am,Two suspects attempted to steal bicycles / Arrested by UCPD officers / Suspect had knife in his possession,arrest,W1002,2010-08-22 11:00:00,exact,2010-08-22 10:50:00,2010-08-22 10:50:00
272,theft,6011 s. ingleside (parking lot),8/23/10 2:31 pm,8/20/10 to 8/23/10 5:00 pm to 9:30 am,Unknown person pried open tool box and took tools,open,W1003,2010-08-23 14:31:00,range,2010-08-20 17:00:00,2010-08-23 09:30:00
273,theft,5721 s. maryland (comer hospital),8/23/10 3:56 pm,8/22/10 11:00 am to 1:00 pm,Cell phone taken from patient's room,open,W1004,2010-08-23 15:56:00,range,2010-08-22 11:00:00,2010-08-22 13:00:00
274,theft,1005 e. 60th st. (burton-judson court),8/24/10 12:24 pm,8/24/10 9:45 am to 11:00 am,Unknown person took a Dell laptop computer from an unlocked office,open,W1005,2010-08-24 12:24:00,range,2010-08-24 09:45:00,2010-08-24 11:00:00
275,criminal trespass to land,6054 s. drexel (uc office bldg.),8/24/10 6:56 pm,8/24/10 6:53 pm,Unauthorized male gained entry to secured area of building by forcing door / Left premises after being confronted by a staff member,closed,W1008,2010-08-24 18:56:00,exact,2010-08-24 18:53:00,2010-08-24 18:53:00
276,burglary,ingleside between 54th & 55th,8/24/10 9:54 pm,8/24/10 6:15 pm to 9:15 pm,"Unknown person gained entry to apartment by undetermined means / Took 3 computers, TV, Canon camera, electric shaver",open,W1006,2010-08-24 21:54:00,range,2010-08-24 18:15:00,2010-08-24 21:15:00
277,battery,stony island at 62nd,8/24/10 10:53 pm,8/24/10 10:40 pm,"During the course of a verbal altercation, three men struck another man with their fists / Arrest by UCPD",arrest,W1007,2010-08-24 22:53:00,exact,2010-08-24 22:40:00,2010-08-24 22:40:00
278,injured person,5840 s. maryland (parking structure),8/25/10 9:42 am,8/25/10 9:15 am,Woman walking in the parking structure tripped and fell injuring her face and right arm,closed,W1009,2010-08-25 09:42:00,exact,2010-08-25 09:15:00,2010-08-25 09:15:00
279,miscellaneous,54th & harper,8/25/10 9:46 am,8/21/10 4:00 pm,Man reports loaning money to a stranger on the street who promised repayment / Loan not repaid,closed,W1010,2010-08-25 09:46:00,exact,2010-08-21 16:00:00,2010-08-21 16:00:00
280,theft from motor vehicle,ellis between 49th & 50th,8/25/10 10:29 am,8/24/10 to 8/25/10 9:30 pm to 10:00 am,Unknown person smashed front passenger's side window of car parked on the street and took an i-pod,open,W1011,2010-08-25 10:29:00,range,2010-08-24 21:30:00,2010-08-25 10:00:00
281,theft,920 e. 59th st. (ucmc),8/25/10 10:48 am,8/20/10 to 8/24/10 4:00 pm to 2:00 pm,Dell desk top computer taken from office,open,W1012,2010-08-25 10:48:00,range,2010-08-20 16:00:00,2010-08-24 14:00:00
282,possession of controlled substance,cottage grove between 58th & 59th,8/25/10 11:05 pm,8/25/10 11:05 pm,UCPD officers arrested a male subject for possession of heroin / Turned over to CPD,arrest,W1013,2010-08-25 23:05:00,exact,2010-08-25 23:05:00,2010-08-25 23:05:00
284,criminal damage to property,53rd between ellis & greenwood,8/26/10 12:07 am,8/24/10 to 8/25/10 4:45 pm to 11:20 pm,Kitchen window broken in unoccupied dwelling unit,open,W1015,2010-08-26 00:07:00,range,2010-08-24 16:45:00,2010-08-25 23:20:00
285,burglary,ellis between 61st & 62nd,8/26/10 7:34 am,8/26/10 6:30 am,"Unknown male entered residence via rear window, took i-pod and wallet / Suspect fled from rear parking area when observed by complainant / Wallet recovered",open,W1016,2010-08-26 07:34:00,exact,2010-08-26 06:30:00,2010-08-26 06:30:00
286,fire alarm,1365 e. 60th st. (orthogenic school),8/26/10 12:24 pm,8/26/10 12:24 pm,Smoke from over-cooked food triggered smoke detector / No fire / CFD responded,closed,W1017,2010-08-26 12:24:00,exact,2010-08-26 12:24:00,2010-08-26 12:24:00
287,theft,900 e. 57th st. (knapp center),8/26/10 12:26 pm,8/26/10 7:30 am to 9:00 am,Change purse fell from woman's pocket while in washroom / Change purse found in washroom by staff member and returned to owner / $98 missing,open,W1018,2010-08-26 12:26:00,range,2010-08-26 07:30:00,2010-08-26 09:00:00
288,burglary,greenwood near 62nd,8/26/10 6:30 pm,8/26/10 7:50 am to 3:00 pm,"Unknown person(s) entered residence through an open window / Took 52"" Sharp TV, key, wine",open,W1019,2010-08-26 18:30:00,range,2010-08-26 07:50:00,2010-08-26 15:00:00
289,stalking,58th at cottage grove,8/26/10 10:12 pm,8/26/10 9:15 pm,Ex-boyfriend stalking and verbally harassing a woman / Subject cautioned and warned not to trespass on UC property,closed,W1020,2010-08-26 22:12:00,exact,2010-08-26 21:15:00,2010-08-26 21:15:00
290,burglary,cornell between 55th & 56th,8/27/10 2:32 am,8/26/10 to 8/27/10 7:05 pm to 2:15 am,"Unknown person(s) gained entry to apartment via rear unlocked rear window / Took 42"" Panasonic TV, Sony laptop computer, bicycle",open,W1021,2010-08-27 02:32:00,range,2010-08-26 19:05:00,2010-08-27 02:15:00
291,theft,55th between cornell & hyde park,8/27/10 4:58 pm,8/27/10 4:50 pm,Two unknown males entered a grocery store / One distracted the clerk while the other took money from the cash register / Both fled the store,open,W1022,2010-08-27 16:58:00,exact,2010-08-27 16:50:00,2010-08-27 16:50:00
292,fire alarm,5445 s. ingleside (maclean house),8/27/10 9:25 pm,8/27/10 9:25 pm,"Malfunctioning alarm, possibly due to high humidity / CFD responded",closed,W1023,2010-08-27 21:25:00,exact,2010-08-27 21:25:00,2010-08-27 21:25:00
293,warrant,midway pl. near drexel,8/27/10 11:45 pm,8/27/10 11:45 pm,UCPD officer arrested man wanted on a warrant,arrest,W1024,2010-08-27 23:45:00,exact,2010-08-27 23:45:00,2010-08-27 23:45:00
294,theft,59th between kimbark & kenwood,8/28/10 6:53 am,8/28/10 2:00 am to 2:30 am,Unattended cell phone taken by unknown person,open,W1025,2010-08-28 06:53:00,range,2010-08-28 02:00:00,2010-08-28 02:30:00
295,arrest,blackstone between 52nd & 53rd,8/28/10 8:53 pm,8/28/10 8:53 pm,UCPD officers arrested two male subjects wanted by CPD for robbery,arrest,W1027,2010-08-28 20:53:00,exact,2010-08-28 20:53:00,2010-08-28 20:53:00
296,missing person,901 e. 58th st. (mitchell er),8/28/10 9:25 pm,8/28/10 5:00 pm to 6:30 pm,Patient missing from Mitchell Emergency Room - Located by CPD and returned unharmed at 11:30 PM,closed,W1026,2010-08-28 21:25:00,range,2010-08-28 17:00:00,2010-08-28 18:30:00
297,criminal trespass to residence,university between 54th & 55th,8/29/10 12:26 am,8/29/10 12:20 am,Unknown male walked into kitchen of apartment via unlocked door / Fled when confronted by residents,open,W1028,2010-08-29 00:26:00,exact,2010-08-29 00:20:00,2010-08-29 00:20:00
298,recovered vehicle,cottage grove at 61st,8/29/10 1:28 am,8/29/10 1:28 am,UCPD officer recovered an unoccupied vehicle reported stolen in another area of the city,closed,W1029,2010-08-29 01:28:00,exact,2010-08-29 01:28:00,2010-08-29 01:28:00
299,missing person,5815 s. maryland (mitchell hospital),8/29/10 8:36 pm,8/29/10 7:30 pm,Patient missing from the hospital treatment area,closed,W1030,2010-08-29 20:36:00,exact,2010-08-29 19:30:00,2010-08-29 19:30:00
300,warrant arrest,55th between cottage grove and drexel,8/29/10 11:21 pm,8/29/10 10:45 pm,UCPD officer arrested a man wanted on warrants,arrest,W1031,2010-08-29 23:21:00,exact,2010-08-29 22:45:00,2010-08-29 22:45:00
301,fire alarm,1100 e. 57th st. (regenstein library),8/30/10 7:01 am,8/30/10 7:01 am,Alarm accidently triggered by workmen / No Fire / CFD responded,closed,W1032,2010-08-30 07:01:00,exact,2010-08-30 07:01:00,2010-08-30 07:01:00
302,criminal damage to motor vehicle,university between 60th & 61st,8/30/10 8:17 am,8/28/10 to 8/30/10 12:00 pm to 8:00 am,Unknown person smashed rear passenger's side window of a car parked on the street,open,W1033,2010-08-30 08:17:00,range,2010-08-28 12:00:00,2010-08-30 08:00:00
303,hit & run crash / property damage,60th between dorchester & blackstone,8/30/10 9:21 am,8/30/10 9:18 am,Motorist struck an unoccupied University owned vehicle parked on the street / Driver at fault refused to stop and provide required information,open,W1034,2010-08-30 09:21:00,exact,2010-08-30 09:18:00,2010-08-30 09:18:00
304,theft,970 e. 58th st. (bookstore),8/30/10 1:10 pm,8/30/10 12:30 pm to 1:00 pm,Wallet taken from purse placed on the back of a chair as complainant sat at the counter in the café,open,W1035,2010-08-30 13:10:00,range,2010-08-30 12:30:00,2010-08-30 13:00:00
305,injured person,1108 e. 58th st. (rosenwald hall),8/30/10 2:01 pm,8/30/10 2:00 pm,Woman fell on steps injuring her face and shin of her right leg / declined medical attention,closed,W1036,2010-08-30 14:01:00,exact,2010-08-30 14:00:00,2010-08-30 14:00:00
306,warrant arrest,53rd between university & woodlawn,8/30/10 5:00 pm,8/30/10 5:00 pm,UCPD officers arrested a male subject wanted on a warrant,arrest,W1037,2010-08-30 17:00:00,exact,2010-08-30 17:00:00,2010-08-30 17:00:00
307,possession of cannabis,cottage grove at 52nd,8/30/10 5:00 pm,8/30/10 5:00 pm,UCPD officers arrested male subject for possession of marijuana / Turned over to CPD,arrest,W1038,2010-08-30 17:00:00,exact,2010-08-30 17:00:00,2010-08-30 17:00:00
308,irregular conditions,5505 s. ellis (parking structure),8/30/10 7:51 pm,8/30/10 7:51 pm,Woman freed from stuck elevator by Facilities and CFD,closed,W1039,2010-08-30 19:51:00,exact,2010-08-30 19:51:00,2010-08-30 19:51:00
309,fire,blackstone between 61st & 62nd,8/30/10 10:06 pm,8/30/10 10:00 pm,Fire reported in a non-dwelling structure / CFD responded,closed,W1040,2010-08-30 22:06:00,exact,2010-08-30 22:00:00,2010-08-30 22:00:00
310,irregular conditions,1010 e. 59th st. (harper library),8/31/10 12:10 am,8/31/10 12:10 am,UCPD officer touring building found office doors unsecured,closed,W1041,2010-08-31 00:10:00,exact,2010-08-31 00:10:00,2010-08-31 00:10:00
311,assault,58th between maryland & drexel,8/31/10 7:10 am,8/31/10 7:05 am,Unknown male subject standing in the middle of the street threatened female motorist / Subject gone on arrival of police,open,W1042,2010-08-31 07:10:00,exact,2010-08-31 07:05:00,2010-08-31 07:05:00
312,injured person,5840 s. maryland (parking structure),8/31/10 2:01 pm,8/31/10 1:50 pm,"Woman injured her foot on a ""concrete wheel stop"" on the 4th floor of the parking structure / Declined medical attention",closed,W1044,2010-08-31 14:01:00,exact,2010-08-31 13:50:00,2010-08-31 13:50:00
313,theft,kimbark between 51st & 52nd,8/31/10 2:34 pm,7/31/10 to 8/30/10 5:00 pm to 10:30 am,Secured bicycle taken from rear of apartment building,open,W1043,2010-08-31 14:34:00,range,2010-07-31 17:00:00,2010-08-30 10:30:00
314,theft,970 e. 58th st. (bookstore),9/1/10 11:05 am,9/1/10 11:05 am,Man left the bookstore café without paying for food / Arrest,arrest,W1045,2010-09-01 11:05:00,exact,2010-09-01 11:05:00,2010-09-01 11:05:00
315,lost property,1100 e. 53rd st. (neighborhood residence),9/1/10 6:06 pm,8/31/10 4:30 pm,Man reports losing keys to his apartment,closed,W1046,2010-09-01 18:06:00,exact,2010-08-31 16:30:00,2010-08-31 16:30:00
316,lost property,5815 s. maryland (mitchell hospital),9/1/10 8:02 pm,9/1/10 8:00 am to 7:00 pm,Patient misplaced cell phone,closed,W1047,2010-09-01 20:02:00,range,2010-09-01 08:00:00,2010-09-01 19:00:00
317,criminal damage to property,kimbark between 55th & 56th,9/1/10 9:24 pm,9/1/10 9:20 pm,Unknown person smashed glass in rear door of residential building,open,W1048,2010-09-01 21:24:00,exact,2010-09-01 21:20:00,2010-09-01 21:20:00
318,unlawful use of a weapon,ellis between 48th & 49th,9/1/10 9:32 pm,9/1/10 9:32 pm,UCPD officer arrested a male subject who had a handgun in his possession,arrest,W1051,2010-09-01 21:32:00,exact,2010-09-01 21:32:00,2010-09-01 21:32:00
319,burglary,ellis between 61st & 62nd,9/1/10 10:21 pm,9/1/10 8:00 pm to 10:00 pm,"Unknown person gained entry to apartment taking a laptop computer, backpack, cell phone, wallet, and keys / No signs of forced entry",open,W1049,2010-09-01 22:21:00,range,2010-09-01 20:00:00,2010-09-01 22:00:00
320,irregular conditions,6054 s. drexel (uc office bldg.),9/2/10 3:11 am,9/2/10 3:11 am,UCPD officer discovered exterior door did not properly secure / Facilities notified,closed,W1050,2010-09-02 03:11:00,exact,2010-09-02 03:11:00,2010-09-02 03:11:00
321,lost property,out of area - 500 n. michigan av.,9/2/10 9:20 am,8/26/10 to 8/27/10 9:00 am to 12:00 pm,Man believes he lost a passport from his pocket while on North Michigan Av.,closed,W1052,2010-09-02 09:20:00,range,2010-08-26 09:00:00,2010-08-27 12:00:00
322,aggravated robbery,53rd between woodlawn & kimbark,9/2/10 1:56 pm,9/2/10 1:50 pm,Man implying he had a weapon demanded cash from a bank teller / Subject took cash and fled,open,W1053,2010-09-02 13:56:00,exact,2010-09-02 13:50:00,2010-09-02 13:50:00
323,damage to property,5840 s. maryland (parking structure),9/2/10 2:12 pm,9/2/10 2:10 pm,Witness observed a vehicle strike the rear bumper of a parked car while pulling into a parking space / Information relayed to owner of the damaged vehicle,closed,W1054,2010-09-02 14:12:00,exact,2010-09-02 14:10:00,2010-09-02 14:10:00
324,theft from motor vehicle,dorchester between 51st & 52nd,9/2/10 3:40 pm,9/2/10 3:40 pm,Man smashed windows of two cars parked on the street and took GPS devices / Arrest by UCPD,arrest,W1057,2010-09-02 15:40:00,exact,2010-09-02 15:40:00,2010-09-02 15:40:00
325,domestic battery,lakeshore dr. between 50th & 51st,9/2/10 3:50 pm,6/11/10 10:00 pm,Woman reported being physically abused on several occasions / Provided with information and options relating to domestic violence,open,W1055,2010-09-02 15:50:00,exact,2010-06-11 22:00:00,2010-06-11 22:00:00
327,theft,55th between ellis & greenwood,9/2/10 11:22 pm,9/2/10 11:22 pm,Unknown person took bicycle that was secured to a tree with a chain,open,W1058,2010-09-02 23:22:00,exact,2010-09-02 23:22:00,2010-09-02 23:22:00
328,theft,950 e. 59th st. (billings hospital),9/3/10 12:13 pm,9/2/10 to 9/3/10 8:00 pm to 8:00 am,Apple I-pad taken from an unsecured cabinet in a secured office,open,W1059,2010-09-03 12:13:00,range,2010-09-02 20:00:00,2010-09-03 08:00:00
329,hazardous material incident,929 e. 57th st. (gordon center),9/3/10 2:49 pm,9/3/10 2:45 pm,Container of methylene chloride fell from a cart and spilled onto the sidewalk / CFD Haz Mat team responded / Area secured and cleaned / Safety responded,closed,W1060,2010-09-03 14:49:00,exact,2010-09-03 14:45:00,2010-09-03 14:45:00
330,information,1401 e. hyde park (carlson hall),9/3/10 6:14 pm,9/3/10 6:13 pm,Tenant reported an odor of gas in his apartment / Pilot on stove was unlit / CFD responded,closed,W1062,2010-09-03 18:14:00,exact,2010-09-03 18:13:00,2010-09-03 18:13:00
331,injured person,5815 s. maryland (mitchell hospital),9/3/10 6:26 pm,9/3/10 5:00 pm,Man walking in corridor being cleaned slipped and fell injuring his right shoulder / Received treatment at ER,closed,W1061,2010-09-03 18:26:00,exact,2010-09-03 17:00:00,2010-09-03 17:00:00
332,theft,5530 s. ellis (ratner ac),9/3/10 7:21 pm,9/3/10 6:20 pm to 7:10 pm,"Unknown person took wallet, keys, and cell phone from an unsecured locker in men's locker room",open,W1063,2010-09-03 19:21:00,range,2010-09-03 18:20:00,2010-09-03 19:10:00
333,armed robbery,drexel between 50th & 51st,9/3/10 8:57 pm,9/3/10 8:30 pm,Unknown male armed with a handgun took money from a man on the street and shot him in the leg before fleeing,open,W1064,2010-09-03 20:57:00,exact,2010-09-03 20:30:00,2010-09-03 20:30:00
334,assault,5815 s. maryland (mitchell hospital),9/4/10 12:55 am,9/4/10 12:55 am,"Visitor, who was creating a disturbance, verbally assaulted a nurse / Removed from hospital",closed,W1065,2010-09-04 00:55:00,exact,2010-09-04 00:55:00,2010-09-04 00:55:00
335,fire alarm,1414 e. 59th st. (international house),9/4/10 1:44 am,9/4/10 1:44 am,Alarm malfunction / No fire or smoke / CFD responded,closed,W1067,2010-09-04 01:44:00,exact,2010-09-04 01:44:00,2010-09-04 01:44:00
336,burglary,52nd between greenwood & university,9/4/10 1:45 am,9/3/10 to 9/4/10 5:30 am to 12:30 am,"Unknown person entered residence by via rear door or window taking a 42"" TV, laptop computer, jewelry",open,W1066,2010-09-04 01:45:00,range,2010-09-03 05:30:00,2010-09-04 00:30:00
337,fire alarm,5640 s. university (bartlett commons),9/4/10 10:23 am,9/4/10 10:23 am,Smoke from cooking triggered alarm because staff neglected to utilize exhaust fans over grill / CFD responded,closed,W1068,2010-09-04 10:23:00,exact,2010-09-04 10:23:00,2010-09-04 10:23:00
338,burglary,cornell between 55th & 56th,9/4/10 11:47 am,9/4/10 9:50 am to 11:45 am,"Unknown person entered residence by forcing front door / Took laptop computer, Power Book, i-Pod, jewelry",open,W1069,2010-09-04 11:47:00,range,2010-09-04 09:50:00,2010-09-04 11:45:00
339,lost property,out of area- division & state,9/4/10 3:27 pm,9/4/10 1:00 am,Man lost wallet containing UC ID card,closed,W1070,2010-09-04 15:27:00,exact,2010-09-04 01:00:00,2010-09-04 01:00:00
340,theft from motor vehicle,56th between university & woodlawn,9/4/10 7:11 pm,9/3/10 6:00 pm to 8:00 pm,"Unknown person took laptop computer, air mattress and passport from unlocked vehicle parked on the street",open,W1071,2010-09-04 19:11:00,range,2010-09-03 18:00:00,2010-09-03 20:00:00
341,activated alarm,university at 64th,9/4/10 10:20 pm,9/4/10 10:20 pm,Alarm activated in public school building / Checked exterior and notified CPS staff,closed,W1072,2010-09-04 22:20:00,exact,2010-09-04 22:20:00,2010-09-04 22:20:00
342,traffic crash,5505 s. ellis,9/5/10 8:28 pm,9/5/10 8:28 pm,Southbound taxi turning left into parking structure struck a bicycle northbound on Ellis / No injuries or property damage reported,closed / two citations issued,W1073,2010-09-05 20:28:00,exact,2010-09-05 20:28:00,2010-09-05 20:28:00
343,fire alarm,6051 s. ellis,9/5/10 11:52 pm,9/5/10 11:52 pm,False alarm / No smoke or fire detected / CFD responded,closed,W1074,2010-09-05 23:52:00,exact,2010-09-05 23:52:00,2010-09-05 23:52:00
344,irregular conditions,1101 e. 57th st. (zoology),9/6/10 12:35 am,9/6/10 12:35 am,UCPD officer found entry door unsecured / Checked premises / Facilities notified,closed,W1075,2010-09-06 00:35:00,exact,2010-09-06 00:35:00,2010-09-06 00:35:00
345,criminal damage to property,woodlawn between 62nd & 63rd,9/6/10 5:18 pm,9/6/10 4:20 pm,Three vehicles parked on the street struck by pellets,open,W1076,2010-09-06 17:18:00,exact,2010-09-06 16:20:00,2010-09-06 16:20:00
346,telephone harassment,cornell between 55th & 56th,9/6/10 6:59 pm,9/5/10 4:51 pm,Complainant reports receipt of unwanted phone calls after informing caller to desist,open,W1077,2010-09-06 18:59:00,exact,2010-09-05 16:51:00,2010-09-05 16:51:00
347,theft,53rd between kenwood & dorchester,9/7/10 1:24 pm,8/31/10 9:00 pm,A man riding a bicycle grabbed a cell phone from the hand of a woman walking on the sidewalk and rode off,open,W1078,2010-09-07 13:24:00,exact,2010-08-31 21:00:00,2010-08-31 21:00:00
348,theft,5812 s. ellis (brain research pavilion),9/7/10 6:38 pm,9/7/10 7:30 am to 6:30 pm,Bicycle secured to bike rack with chain taken by unknown person,open,W1079,2010-09-07 18:38:00,range,2010-09-07 07:30:00,2010-09-07 18:30:00
349,activated alarm,924 e. 57th st. (biological sciences lc),9/8/10 4:49 am,9/8/10 4:49 am,Radiation alarm activated / Detection sensors showed negative results / Area secure / Hospital Safety responded,closed,W1080,2010-09-08 04:49:00,exact,2010-09-08 04:49:00,2010-09-08 04:49:00
350,theft,5838 s. kenwood (lab school),9/8/10 5:32 pm,9/8/10 8:00 am to 3:30 pm,Bicycle chained to a bike rack taken by an unknown person,open,W1081,2010-09-08 17:32:00,range,2010-09-08 08:00:00,2010-09-08 15:30:00
351,theft from motor vehicle,55th between drexel and ellis,9/8/10 5:55 pm,9/8/10 9:00 am to 5:30 pm,Unknown person smashed passenger's side window of car parked on the street and took a GPS devise,open,W1082,2010-09-08 17:55:00,range,2010-09-08 09:00:00,2010-09-08 17:30:00
352,aggravated battery,drexel between 50th & 51st,9/8/10 6:52 pm,9/8/10 6:50 pm,"Unknown male approached a group of males in a park, fired a handgun striking victim in the left buttock / Transported to hospital by CFD EMS",open,W1083,2010-09-08 18:52:00,exact,2010-09-08 18:50:00,2010-09-08 18:50:00
353,fire alarm,6035 s. blackstone (south campus chiller plant),9/8/10 8:58 pm,9/8/10 8:58 pm,Fire alarm pump activated / No smoke or fire / CFD responded,closed,W1084,2010-09-08 20:58:00,exact,2010-09-08 20:58:00,2010-09-08 20:58:00
354,armed robbery,59th between greenwood & university,9/8/10 10:49 pm,9/8/10 10:48 pm,"Three males, one armed with a handgun, another with a knife, took a wallet from a man on the street and drove off in a maroon, 4-door Cadillac / Suspects detained by UCPD",pending cpd investigation,W1085,2010-09-08 22:49:00,exact,2010-09-08 22:48:00,2010-09-08 22:48:00
355,weapons violation,greenwood at 62nd,9/9/10 8:23 pm,9/9/10 8:23 pm,UCPD officer arrested male subject for possession of an air rifle,arrest,W1087,2010-09-09 20:23:00,exact,2010-09-09 20:23:00,2010-09-09 20:23:00
356,theft,1100 e. 57th st. (regenstein library),9/10/10 10:53 am,9/9/10 to 9/10/10 4:30 pm to 8:30 am,Book taken from desk top in an unsecured area,open,W1087,2010-09-10 10:53:00,range,2010-09-09 16:30:00,2010-09-10 08:30:00
357,chemical spill,5747 s. ellis (jones lab),9/10/10 1:33 pm,9/10/10 1:33 pm,A container of chloroform was spilled on the 3rd floor / Safety and CFD responded / Area cleared at 1:55 PM,closed,W1088,2010-09-10 13:33:00,exact,2010-09-10 13:33:00,2010-09-10 13:33:00
358,suspicious package,935 e. 56th st. (high energy physics),9/10/10 1:21 pm,9/10/10 10:00 am,Staff members discovered a suspicious metal box with electrical wires attached / CPD Bomb personnel investigated / Harmless device,closed,W1089,2010-09-10 13:21:00,exact,2010-09-10 10:00:00,2010-09-10 10:00:00
359,criminal trespass to property,5514 s. university (pierce hall),9/11/10 10:21 am,9/11/10 10:21 am,Unauthorized male found sleeping in loading dock area / Given trespass warning and released,closed,W1091,2010-09-11 10:21:00,exact,2010-09-11 10:21:00,2010-09-11 10:21:00
360,irregular conditions,5800 s. stony island (doctors hospital),9/11/10 11:03 am,9/11/10 11:00 am,Exterior door of vacant building found unlocked / Facilities notified,closed,W1092,2010-09-11 11:03:00,exact,2010-09-11 11:00:00,2010-09-11 11:00:00
361,theft,stony island at 57th,9/11/10 2:33 pm,9/11/10 2:33 pm,UCPD officers saw man take a tire from a bike secured to a bicycle rack / Arrest,arrest,W1093,2010-09-11 14:33:00,exact,2010-09-11 14:33:00,2010-09-11 14:33:00
362,theft from motor vehicle,midway pl. between cottage grove & drexel,9/11/10 10:21 pm,9/11/10 12:00 pm to 10:05 pm,Unknown person smashed driver's side window and took GPS device from a car parked on the street,open,W1094,2010-09-11 22:21:00,range,2010-09-11 12:00:00,2010-09-11 22:05:00
363,public indecency,university between 55th & 56th,9/12/10 9:03 am,9/12/10 9:00 am,Complainant observed a male committing a lewd act while sitting in a vehicle parked on the street / Subject arrested by UCPD on 9/18/10,arrest,W1095,2010-09-12 09:03:00,exact,2010-09-12 09:00:00,2010-09-12 09:00:00
364,theft from motor vehicle,midway pl. between drexel & ellis,9/12/10 11:50 pm,9/12/10 2:30 pm to 11:30 pm,Unknown person smashed passenger's side window of vehicle parked on the street and took GPS device,open,W1096,2010-09-12 23:50:00,range,2010-09-12 14:30:00,2010-09-12 23:30:00
365,theft,5823 s. kenwood (sunny gym),9/13/10 7:21 am,9/7/10 2:24 pm to 4:30 pm,Unknown person took cell phone from a back pack in a gym locker / Uncertain if locker was secured,open,W1097,2010-09-13 07:21:00,range,2010-09-07 14:24:00,2010-09-07 16:30:00
366,bomb threat,6054 s. drexel (ucpd hq),9/13/10 2:44 pm,9/13/10 2:44 pm,Unknown caller threatened to bomb police station,open,W1098,2010-09-13 14:44:00,exact,2010-09-13 14:44:00,2010-09-13 14:44:00
367,armed robbery,university at 64th,9/13/10 5:38 pm,9/13/10 5:38 pm,Three youths were stopped on the street by a youth armed with a weapon / Suspect attempted to take a Blackberry from one victim / Arrest by UCPD / BB gun recovered from suspect,arrest,W1099,2010-09-13 17:38:00,exact,2010-09-13 17:38:00,2010-09-13 17:38:00
368,lost / found property,out of area - 55th & prairie,9/14/10 8:10 am,9/13/10 10:00 am,UC ID card and driver's license lost on CTA el train was found and held for owner,closed,W1100,2010-09-14 08:10:00,exact,2010-09-13 10:00:00,2010-09-13 10:00:00
369,burglary,kimbark between 53rd & 54th,9/14/10 11:36 pm,9/14/10 7:30 pm to 9:30 pm,Unknown person gained entry to apartment via unsecured window / Took laptop computer & cell phone,open,W1101,2010-09-14 23:36:00,range,2010-09-14 19:30:00,2010-09-14 21:30:00
370,cyber stalking,5815 s. maryland (ucmc),9/15/10 2:23 pm,9/13/10 to 9/15/10 various,"Complainant receiving harassing, unwanted messages from an individual",open,W1102,2010-09-15 14:23:00,range,2010-09-13 00:00:00,2010-09-15 23:59:00
371,reckless conduct,south shore dr. at 56th,9/15/10 8:41 pm,9/15/10 8:41 pm,"Two suspects, attempting to elude police, ran in the street through traffic causing a hazardous situation / Arrest by UCPD",arrest,W1103,2010-09-15 20:41:00,exact,2010-09-15 20:41:00,2010-09-15 20:41:00
372,burglary,55th st. between drexel & ellis,9/16/10 1:27 am,9/16/10 1:15 am,Woman sleeping in her bedroom was awakened by an unknown man poised over her / Suspect fled when a roommate awoke and screamed / Suspect took a laptop computer and other items from the residence,open,W1104,2010-09-16 01:27:00,exact,2010-09-16 01:15:00,2010-09-16 01:15:00
373,burglary,55th between hyde park & everett,9/16/10 8:36 am,9/15/10 6:00 pm to 11:30 pm,"Unknown person gained entry to residence via unsecured window / Took Gateway laptop computer, Mac PowerBook computer, HP laptop computer, shoulder and messenger bags",open,W1105,2010-09-16 08:36:00,range,2010-09-15 18:00:00,2010-09-15 23:30:00
374,theft,970 e. 57th st. (bookstore),9/16/10 12:23 pm,9/16/10 12:20 pm,Unknown male grabbed a book and ran out of the store without paying,open,W1106,2010-09-16 12:23:00,exact,2010-09-16 12:20:00,2010-09-16 12:20:00
375,injured person,1100 e. 58th st. (ryerson hall),9/16/10 1:45 pm,9/16/10 1:40 pm,Worker fell from scaffolding at the rear of the building / Transported to hospital by CFD EMS,closed,W1107,2010-09-16 13:45:00,exact,2010-09-16 13:40:00,2010-09-16 13:40:00
376,missing person,kenwood between 57th & 58th,9/16/10 4:00 pm,9/16/10 7:50 am to 3:00 pm,Male youth left home for school but did not attend class / Youth later returned home unharmed,closed,W1110,2010-09-16 16:00:00,range,2010-09-16 07:50:00,2010-09-16 15:00:00
377,theft,1212 e. 59th st. (ida noyes hall),9/16/10 4:19 pm,9/3/10 to 9/15/10 4:00 pm to 3:00 pm,5 Xerox cartridges taken from room that may not have been secured,open,W1108,2010-09-16 16:19:00,range,2010-09-03 16:00:00,2010-09-15 15:00:00
378,theft,1101 e. 56th st. (max palevsky commons),9/16/10 5:06 pm,9/13/10 to 9/16/10 2:00 pm to 10:30 am,Unknown person took secured bicycle from bike rack,open,W1109,2010-09-16 17:06:00,range,2010-09-13 14:00:00,2010-09-16 10:30:00
379,theft of motor vehicle,55th between blackstone & harper,9/17/10 9:40 am,9/16/10 to 9/17/10 9:30 pm to 9:30 am,1997 green Dodge Caravan taken from parking place on the street,open,W1111,2010-09-17 09:40:00,range,2010-09-16 21:30:00,2010-09-17 09:30:00
380,found property,58th & university (quad),9/17/10 2:46 pm,9/17/10 2:46 pm,Staff member found camera bag containing batteries / Turned over to CPD for safekeeping,closed,W1112,2010-09-17 14:46:00,exact,2010-09-17 14:46:00,2010-09-17 14:46:00
381,theft from motor vehicle,59th near woodlawn,9/17/10 4:54 pm,9/17/10 0750 to 4:50 pm,Unknown person smashed window of car parked on the street and took GPS device and coin purse,open,W1113,2010-09-17 16:54:00,range,,
382,theft of motor vehicle,cottage grove between 58th & 59th,9/17/10 5:39 pm,9/17/10 3:00 pm to 5:00 pm,2007 silver 4 dr. Pontiac Torrent taken from parking place on the street,open,W1114,2010-09-17 17:39:00,range,2010-09-17 15:00:00,2010-09-17 17:00:00
383,burglary,54th pl. between drexel and ellis,9/17/10 8:56 pm,9/17/10 6:30 pm to 8:30 pm,"Unknown person entered residence via open kitchen window / Took laptop computer, 2 video cameras, cell phone",open,W1115,2010-09-17 20:56:00,range,2010-09-17 18:30:00,2010-09-17 20:30:00
384,burglary,kimbark between 57th & 58th,9/17/10 9:42 pm,9/17/10 6:35 pm to 9:20 pm,"Unknown person entered residence via an open window / Took two Mac laptop computers, Canon EOS camera, jewelry",open,W1116,2010-09-17 21:42:00,range,2010-09-17 18:35:00,2010-09-17 21:20:00
385,public indecency,university between 55th & 56th,9/18/10 8:56 am,9/18/10 8:50 am,Man observed committing an indecent act as he sat in his vehicle parked on the street / Arrest by UCPD,arrest,W1117,2010-09-18 08:56:00,exact,2010-09-18 08:50:00,2010-09-18 08:50:00
386,possession of burglary tools,ellis between 53rd & 54th,9/18/10 1:52 pm,9/18/10 1:40 pm,UCPD officers questioning suspicious person in the alley found he possessed lock picks and other tools used in burglaries,arrest,W1118,2010-09-18 13:52:00,exact,2010-09-18 13:40:00,2010-09-18 13:40:00
387,criminal damage to property,ellis between 54th & 55th,9/18/10 2:35 pm,9/17/10 to 9/18/10 9:15 pm to 2:25 pm,Unknown person bent front wheel and slashed tires of a bicycle secured to a city sign post,open,W1119,2010-09-18 14:35:00,range,2010-09-17 21:15:00,2010-09-18 14:25:00
388,theft from motor vehicle,55th at blackstone,9/18/10 11:11 pm,9/18/10 5:00 pm to 11:00 pm,Unknown person smashed driver's side window of car parked on the street and took GPS device,open,W1120,2010-09-18 23:11:00,range,2010-09-18 17:00:00,2010-09-18 23:00:00
389,theft,6031 s. ellis (south campus residence hall),9/18/10 11:19 pm,9/17/10 to 9/18/10 5:00 pm to 10:25 am,Unknown person took bicycle that had been secured to a bike rack,open,W1121,2010-09-18 23:19:00,range,2010-09-17 17:00:00,2010-09-18 10:25:00
390,burglary,drexel at 54th,9/19/10 12:20 am,9/18/10 1:30 pm to 10:30 pm,"Unknown person entered residence via window / Took laptop computer, wallet, jewelry",open,W1122,2010-09-19 00:20:00,range,2010-09-18 13:30:00,2010-09-18 22:30:00
391,criminal damage to vehicle,greenwood between 54th & 55th,9/19/10 7:59 am,9/17/10 to 9/18/10 11:45 pm to 8:30 am,Unknown person(s) slashed four tires of car parked in parking lot,open,W1123,2010-09-19 07:59:00,range,2010-09-17 23:45:00,2010-09-18 08:30:00
392,criminal damage to vehicle,greenwood between 54th & 55th,9/19/10 11:30 am,9/17/10 to 9/18/10 9:30 pm to 10:30 pm,Unknown person(s) slashed four tires of car parked in parking lot,open,W1124,2010-09-19 11:30:00,range,2010-09-17 21:30:00,2010-09-18 22:30:00
393,traffic crash,53rd at dorchester,9/19/10 3:49 pm,9/19/10 3:49 pm,Driver of rental van making a right turn struck a parked UCPD vehicle / Report by CPD,closed,W1125,2010-09-19 15:49:00,exact,2010-09-19 15:49:00,2010-09-19 15:49:00
394,theft from motor vehicle,cottage grove between 58th & 59th,9/19/10 7:37 pm,9/19/10 4:00 pm to 7:00 pm,Unknown person smashed window of car parked on the street and took two DVD players and two Nintendo players,open,W1126,2010-09-19 19:37:00,range,2010-09-19 16:00:00,2010-09-19 19:00:00
395,theft,5815 s. maryland (ucmc),9/19/10 9:55 pm,9/19/10 1:30 pm to 6:00 pm,"Unknown person took white lab coat, 4g i-Phone, and local anesthetic drug from secured room",open,W1127,2010-09-19 21:55:00,range,2010-09-19 13:30:00,2010-09-19 18:00:00
396,robbery,ingleside at 60th,9/20/10 3:32 pm,9/20/10 3:30 pm,Two unknown males took a shoulder bag and coat from a woman walking on the sidewalk,open,W1128,2010-09-20 15:32:00,exact,2010-09-20 15:30:00,2010-09-20 15:30:00
397,aggravated battery,cottage grove at 47th,9/20/10 8:29 pm,9/20/10 8:25 pm,"Two men walking on the sidewalk wounded by gunfire from unknown person(s) in a passing vehicle / One man struck in the right foot, the other man struck in the lower left leg / Taken to hospital by CFD EMS",open,W1129,2010-09-20 20:29:00,exact,2010-09-20 20:25:00,2010-09-20 20:25:00
398,theft,blackstone between 54th & 55th,9/21/10 8:35 am,9/20/10 to 9/21/10 7:00 pm to 8:00 am,Unsecured bicycle taken from basement of residential building,open,W1130,2010-09-21 08:35:00,range,2010-09-20 19:00:00,2010-09-21 08:00:00
399,attempt aggravated robbery,60th between drexel & ingleside,9/21/10 9:28 am,9/21/10 9:20 am,"Unknown male, implying he was armed, attempted to take purse from woman walking on the sidewalk / Woman screamed / Suspect ran off",open,W1131,2010-09-21 09:28:00,exact,2010-09-21 09:20:00,2010-09-21 09:20:00
400,criminal damage to vehicle,56th between kimbark & kenwood,9/21/10 11:14 am,9/19/10 to 9/20/10 7:00 am to 6:00 pm,Unknown person smashed passenger's side window of a car parked on the street,open,W1132,2010-09-21 11:14:00,range,2010-09-19 07:00:00,2010-09-20 18:00:00
401,theft,1212 e. 59th st. (ida noyes),9/21/10 5:15 pm,9/21/10 9:30 am to 2:20 pm,Wallet taken from woman's purse / Subsequent unauthorized use of credit cards reported,open,W1133,2010-09-21 17:15:00,range,2010-09-21 09:30:00,2010-09-21 14:20:00
402,burglary,kenwood between 54th & 55th,9/21/10 11:58 pm,9/21/10 5:30 pm to 11:50 pm,Unknown person gained entry to apartment via unlocked rear door / Took two laptop computers and a computer monitor,open,W1134,2010-09-21 23:58:00,range,2010-09-21 17:30:00,2010-09-21 23:50:00
403,theft,5721 s. maryland (comer hospital),9/22/10 7:56 pm,9/21/10 7:00 am to 1:00 pm,i-Pod taken from a work bag left unattended in a triage room,open,W1135,2010-09-22 19:56:00,range,2010-09-21 07:00:00,2010-09-21 13:00:00
404,found property,ingleside between 61st & 62nd,9/22/10 8:15 am,9/22/10 7:45 am,Wallet found by a citizen turned over to UCPD / Owner retrieved property at UCPD HQ,closed,W1136,2010-09-22 08:15:00,exact,2010-09-22 07:45:00,2010-09-22 07:45:00
405,theft from motor vehicle,midway pl. between harper & stony island,9/22/10 12:40 pm,9/22/10 8:30 am to 12:30 pm,Unknown person smashed window of vehicle parked on the street and took a GPS device,open,W1137,2010-09-22 12:40:00,range,2010-09-22 08:30:00,2010-09-22 12:30:00
406,lost property,55th & shore drive,9/22/10 1:02 pm,9/21/10 9:00 am to 10:30 pm,Key ring and keys lost between 55th & Shore Drive and Campus,closed,W1138,2010-09-22 13:02:00,range,2010-09-21 09:00:00,2010-09-21 22:30:00
407,theft,6031 s. ellis (south campus residence hall),9/22/10 2:24 pm,9/18/10 to 9/19/10 9:00 pm to 11:00 am,Unknown person took a bicycle that had been secured to a bike rack,open,W1139,2010-09-22 14:24:00,range,2010-09-18 21:00:00,2010-09-19 11:00:00
408,lost property,61st at woodlawn,9/22/10 6:54 pm,9/14/10 1:00 am,Man reports leaving his cell phone on a Safe Ride Bus,closed,W1140,2010-09-22 18:54:00,exact,2010-09-14 01:00:00,2010-09-14 01:00:00
